,Serial_No,Clothing ID,Age,Title,Review Text,Rating,Recommended IND,Positive Feedback Count,Division Name,Department Name,Class Name
7209,7209,903,49,"So soft, but the pieces don't fit","I ordered the pink, and it was gorgeous. the color and feel were so soft, i would have kept it if it were a blanket. but i did send it back because as a sweater, it just didn't lay right. it has a sort of inside layer that just didn't fit right with the outside sweater layer, so it ended up puffing up on the sides at the waist. that was not flattering. and the hood was too large and floppy looking. too bad.",3,0,0,General Petite,Tops,Fine gauge
7210,7210,1099,33,Please bring this dress back,This dress is so cute! will you be bringing it back retailer?,5,1,4,General,Dresses,Dresses
7211,7211,1098,36,Very flattering!,This dress is very flattering. great unique dress.,5,1,1,General Petite,Dresses,Dresses
7212,7212,1083,37,Very flattering,"This was was a great buy! i got in on sale and the quality is really excellent. the material is thick and stretchy. there is a spanx like liner which is really nice as well for smoothing out the bumps. the dress style and cut is very slimming. i am more a size 14 (at 5'10"") and the 12 fit well. i agree with the other reviewer regarding the twisted shoulder. it doesn't lay on me either like it does on the model, but it doesn't detract from the dress so its a keeper given the other positives.",4,1,2,General Petite,Dresses,Dresses
7213,7213,869,45,,Cute top but does stretch out a bit throughout the day.,4,1,0,General,Tops,Knits
7214,7214,1092,35,"Beautiful design, interesting execution","I saw this in that postcard ""catalog"" and it drew my attention immediately, so when i saw it at the store, i knew i would try it on.
this dress is gorgeous - the lace is sturdy and won't easily be caught on things, the chambray is substantial but light. it's put together well and the slip covers greatly. the material isn't stretchy, but it keeps it shape and i like that. i'm 5'7"" and it hit me right at the knee, so it's a good length if you wanted to wear it with a cardigan to work as a spring",3,1,10,General,Dresses,Dresses
7215,7215,1083,28,Good quality; odd fit,"This just did not sit well on me. while the length was fine and the fabric was a nice thick weave with a flattering amount of stretch, the twist at the shoulder just looked odd. it did not sit flat at all, so it just looked like i had gotten dressed in the dark and had not managed to sort out my sleeves. given the spot-on quality, i would definitely look into other items from this brand, but back this dress went.",3,0,1,General Petite,Dresses,Dresses
7216,7216,903,62,Chic layer,"This hoodie has a lovely, flattering drape and fits true-to-size (m for me), and is light but quite warm. the cottony nylon layers along the front panels and hood add style. it will be warm enough as an outer layer on a slightly brisk day or indoors in cooler weather. i was going to opt for the blue, but in the store, the light gray ~ which is a bit darker and more marled than online (at least on my monitor) ~ looked really lovely and seemed more versatile.",5,1,25,General Petite,Tops,Fine gauge
7217,7217,860,55,Betcha just can't buy one!,"Great turtleneck, very comfortable and not tight around the neck at all. the material is super soft and washes well. i ended up getting all 3 colors. my only regret is that there are only 3 colors! i absolutely love this top. i also like the many complements i've received while wearing them. i am full figured and the fit is very flattering.",5,1,1,General,Tops,Knits
7218,7218,1092,34,Beware if you're fuller in the chest,"I loved the lace detailing all over this dress and the fact it had pockets and was mostly cotton. it just looked so inviting, so i grabbed two sizes to try on (10 & 12) that 99% of the time fit me with retailer clothes. here are my thoughts:
__________
pros:
- lace detailing is lovely all over.
- everything runs tts except at the bust (see below).
- breathable fabric, comfortable.
_________
cons:
- i'm a 36c and could not button the top two buttons of this dress in a size 10 (i'm 5'9, hourglass, a",3,1,122,General,Dresses,Dresses
7219,7219,868,53,"Versatile, comfy, we'll made!","A feminine yet mature looking cami. i did not need to wear a bra because the material is thick and stretchy (i am a 34a). it looks great with a pencil skirt as well as chino shorts. feels soft and comfy. can dress it up or down. i took a small and it fit perfectly  (l am 5'4"" 120lbs).",5,1,3,General,Tops,Knits
7220,7220,1083,40,Gorgeous dress,"I love the dress, fits as pictured , i'm a size 4 and fits just right. it is a keeper, well made.",5,1,0,General Petite,Dresses,Dresses
7221,7221,1092,42,Pretty dress,"It's a pretty dress, my only concern is the sleeve length. it's an awkward length and makes the dress look a little frumpy. i turned the sleeve up once and it looks so much better!. or, if you are a savvy sewer, you may want to tighten a little in the arms so the sleeve is a bit more fitted. overall quality and feel is very good. i usually fit into a 6, but for this dress i ordered both 6 and 8 and kept the 8. the chest is a bit snug and the button pops open if you don't order the correct size.",4,1,0,General,Dresses,Dresses
7222,7222,1098,46,A longing,"I was eyeing this dress for some time and was undecided about making the purchase. at a reduced price and 40%discount, i had to succumb! i was surprised by the fabric, a bit flimsy. however, the design makes up for the style. i'm anxious to wear at the first opportunity of spring/summer!!!",4,1,0,General,Dresses,Dresses
7223,7223,869,34,Loose comfy shirt,I found it hard to pair with bottoms. fit wasn't very flattering for me.,3,1,0,General,Tops,Knits
7224,7224,903,66,Great hoodie,Very comfortable and looks really good on me. that's very important!,5,1,0,General Petite,Tops,Fine gauge
7225,7225,1092,32,,So disappointed! beautiful dress in the photographs but the cut was incredibly strange. loose and baggy through the top and mid-section but tight around the buttock and thighs.,1,0,0,General,Dresses,Dresses
7226,7226,903,43,This product has great features,It's super soft. it fits great. happy with the purchase.,5,1,0,General Petite,Tops,Fine gauge
7227,7227,409,31,"Cute romper, material... meh","Cute romper, love the pattern but the material seems cheap and flimsy, and is staticky! for the price it should be better quality. also i'm fairly short and hits high on the leg. not sure how anyone taller could make it work.",4,1,6,General,Bottoms,Shorts
7228,7228,903,57,Snap front hoodie,I have many sweaters but i bought this during the sale and it is very soft and comfortable.,4,1,0,General Petite,Tops,Fine gauge
7229,7229,1092,33,Beautiful but slight problem,I'm normally between a 4-6 in retailer dresses. i had to go up to a size 10 just to get the buttons across the chest to close and lay properly without feeling like i would bust out. definitely not for those with any kind of chest.,3,0,6,General,Dresses,Dresses
7230,7230,877,27,,,5,1,0,General,Tops,Knits
7231,7231,183,35,"Beautiful, but narrow","I really like the look of these socks, and have become obsessed we over-the-knee socks for winter this year. they are very tick which is nice for keeping warm and for durability for a long lasting product. my only complaint is that they are very difficult to get over the knee. this can be a great thing, because they certainly do stay put-which is a huge problem with over-the-knee socks. however, by the end of the day i was pretty sure i was going to lose a leg from poor circulation.

i am still",3,0,15,Initmates,Intimate,Legwear
7232,7232,918,34,Breathtakingly lovely,The pictures don't do this cardi justice. it's so lovely and ladylike. it's seems very well made. please can we have more from this designer??,5,1,0,General Petite,Tops,Fine gauge
7233,7233,877,56,Great spring cardigan,Looking forward to wearing this on chilly spring mornings. ordered in the navy. fits true to size.,5,1,0,General,Tops,Knits
7234,7234,877,35,Living in this!!,"This is probably one of the best retailer purchases i have ever made! this is the most comfy and warm cardigan and is a good thickness for fall and winter. i am 5'9, a size 6/8 and the medium was perfect! buy this now!!",5,1,2,General,Tops,Knits
7235,7235,868,32,Huge but so soft,I'll start this by saying i usually wear a m or l depending on the shirt. i'm 20 weeks pregnant and ordered a medium. it's huge! i was thinking i would be able to wear this for a bit while preggo and then would be able to wear it after baby with no problem. i'm going to order a small because the fabric is so soft and i love the design and color.,4,1,1,General,Tops,Knits
7236,7236,877,41,,Comfy cozy!,4,1,0,General,Tops,Knits
7237,7237,906,35,Very pretty and versatile,"This goes well for cool weather. great with jeans or other casual pants. i got the green, it's more of a teal color but pretty. runs large. i usually run between small and medium, i got the small and it's a tad too loose on me.",5,1,0,General Petite,Tops,Fine gauge
7238,7238,877,35,Quality!!!,"This is the best item i have gotten form retailer. the quality is amazing. soft, covers my butt, classic piece!!!",5,1,10,General,Tops,Knits
7239,7239,906,41,Cute but too big need to exchange,"I have a hard time with sizes here. i literally can wear sm-large depending on the brand, so it's hard to buy online. i was worried this would be too short as i'm 5'9' so i got a large and it's a little too bulky. i will be heading to the store to exchange and hope they have a green one left :)",4,1,0,General Petite,Tops,Fine gauge
7240,7240,877,46,Fantastic sweater,"I ordered the navy/gray version in size xl. it fits me true to size, matching the online photos. the colors matched too. the fabric is so soft. it's warm while being lighter in weight. very comfortable. the collar wasn't bulky either. it's made to last. one of my retailer favorites.",5,1,0,General,Tops,Knits
7241,7241,1050,34,"Cute design, poor quality","The embroidery on the side is cute, and they're nice and airy for hot days. however, the stitching on the legs unraveled after only two washes. also, they're extremely long; i'm 5'7 and had to take them up around 3 inches.",3,0,1,General,Bottoms,Pants
7242,7242,1028,24,,,5,1,0,General Petite,Bottoms,Jeans
7243,7243,877,31,,Great long cardigan! i wear this with a simple tank,5,1,4,General,Tops,Knits
7244,7244,183,51,Lovely socks,"These are just perfect, exactly as pictured if not nicer. very soft and comfy with a big sweater on for winter months.",5,1,3,Initmates,Intimate,Legwear
7245,7245,868,32,Size down 1-2 sizes,"I am normally a m-l (170 lbs, 5'4"", 34dd). i ordered this top in a medium knowing it ran big, and it is huge. seriously, i could wear it as a dress. i like the whole loose and comfy top thing, but this is so massive it looks sloppy. i'm going try and return it for a small. hey, i like that i can wear a small! the green color really is pretty, and it's so soft. just need a much smaller size.",3,1,0,General,Tops,Knits
7246,7246,1082,77,Perfect for hot days,I loved the dress way more in person than online. the fabric is very soft and it is quite beautiful. i wear a large in most retailer tops and a size 8/10 in dresses and the large fit perfect.,4,1,3,General Petite,Dresses,Dresses
7247,7247,1028,61,,"These jeans! i am obsessed. the perfect boyfriend fit with an easy, relaxed feel. i feel instantly cooler when i slip into these. do yourself a favor and buy them!!",5,1,0,General Petite,Bottoms,Jeans
7248,7248,118,52,Cute top,Just not as long as in the picture. it hit me at my hips not good!,1,0,0,Initmates,Intimate,Sleep
7249,7249,834,60,Spring blouse,"This is a lovely spring blouse with a touch of linen. the color and fit is exactly as on the model. there is a sweet touch of trim around the waist in a steel blue. i can pull the top over my head without unbuttoning it. it is tts in my opinion. although the buttons on the back add a nice flair, they are very fine bottons and tend to unbutton on their own. i just tightened the buttonholes with white thread and the problem was fixed so, that's why i gave it 4 stars for design.",5,1,3,General,Tops,Blouses
7250,7250,1082,57,Really wanted to love this dress,"As soon as i saw this dress online i loved it and ordered it! unfortunately it just didn't work for me, i tried it in a small, medium and large. for reference i'm 5'2"", 145lbs, 36d. the dress is really pretty in person, but i looked like a little girl in it. my daughter who is 4'9"", 100lbs, 34a, also tried it on and she too looked like a little girl in it. the material is beautiful along with the detail at the neckline, however the neckline is not open like in the picture, it's more pushed toget",2,0,6,General Petite,Dresses,Dresses
7251,7251,877,63,Love love love!!,"This is a fabulous cardigan/jacket!! i saw it on line and read the great reviews and happened to find one of each color in two different stores!! i bought them both!! i have practically lived in them the last week in rainy, cool weather!! the white one goes with everything, and the blue one in fabulous with jeans and probably other things as well. i have gotten several compliments on them immediately. they are just the right weight--not too heavy but heavy enough and a good sturdy, quality mater",5,1,1,General,Tops,Knits
7252,7252,868,44,"So comfy, great fabric","This is such a comfy top, and the fabric is really great. more supple / flowy than i expected. it does run larger than i expected. i typically wear a large, and it's almost more billowy than i would normally prefer. i would love to try a medium to see the difference, but since it was purchased online, i'm just going with it. this will get lots of wear this season.",5,1,5,General,Tops,Knits
7253,7253,877,37,So great i bought it twice!,"I absolutely adore this cardigan. it's easy, so comfortable, stylish and absolutely flattering on every shape!! what i love about it most is how long it is. i'm 5'8 and the large and xl come well below my bum. it's perfect to wear with leggings and boots when i'm having a relaxing easy day, but i can easily dress it up with denim or a dress underneath! totally versatile! i originally bought this in a large and it fit well. but then we got the xl in the store and i snagged that one too because i",5,1,20,General,Tops,Knits
7254,7254,183,25,Could not get it over my calves,These socks were very thin and the elastic at the top was very rigid. i could not get these socks to go any higher than half-way up my calf. i would not recommend this product. it felt very cheap and not of good quality.,1,0,0,Initmates,Intimate,Legwear
7255,7255,918,48,Old retailer is back!!!,"Beautiful and soft and so well made cropped cardigan by the in house retailer branding. the color is more muted in person but will work with many different skirts and pants including jeans. i have many ideas for this lovely cardigan ! the size medium for my 34 dd chest, 145 lbs and 5 '4 inches is perfect and the sleeves bellow out a bit which gives this cardigan a nice sharp look. i agree with the other reviewer--- more colors and more of type of quality  and character please for seasons ahead! lo",5,1,0,General Petite,Tops,Fine gauge
7256,7256,1078,47,"Warm, cozy, timeless, and sexy","It's not often you can find a dress that is warm, cozy, timeless, and sexy at the same time, but this one is it. the material is thick but clings to the body in all the right places. i normally wear an xs or s, and in this i took an xs. sleeves are nice and long. your shoulders are exposed as much as you want them to be, depending on how low you fold over the collar piece. i chose to tack mine down in place, so i'm not always adjusting it.

i wore this dress with black heeled over-the-knee boots",5,1,5,General,Dresses,Dresses
7257,7257,1078,44,Simple and well structured,"This initially caught my eye online and then i immediately tried it on when our store received it. the dress is simple and well structured with a tight sweater weave that almost has a"" hold u in"" feel. therefore, it fits like a glove on!!",5,1,8,General,Dresses,Dresses
7258,7258,1082,41,,"Love this dress. it's a nice addition to my summer wardrobe. easy to wear. i am between a large and an ex large in dresses. i did order it in a large, it was a perfect fit but did exchange it for an ex large. i wanted it to have little more swing to it.",5,1,3,General Petite,Dresses,Dresses
7259,7259,1078,38,Runs big,Love the dress. i usually wear a small and will be exchanging it for an x-small.,4,1,5,General,Dresses,Dresses
7260,7260,906,33,"Beautiful color, looks great on!","This sweater is wonderful for late summer/early fall or cooler weather over long sleeves. the sleeves taper just below the elbow, which seems slightly odd when first putting it on - as though they should be a tad longer (hence the 4 stars), but i quickly forget about this while wearing the sweater and it does look great!",4,1,0,General Petite,Tops,Fine gauge
7261,7261,183,43,Too narrow,"These socks were so narrow, especially on top, that they pinched my thighs and we're almost painful to wear all day. my thighs are pretty narrow, i'm only five feet tall and my legs and hips are the thinnest part of my body. i understand that they need to be reinforced on top so that they don't slip down but these are definitely made for a person who is unhealthily skinny. ""one size"" is definitely not true. they also snag easily.",2,0,0,Initmates,Intimate,Legwear
7262,7262,1078,47,Awesome sweater dress!,"Lovely body hugging dress. hits just below the knee. great with boots as shown, or with heels. very soft material and the peppery color is really pretty. i can see myself wearing this to work and out at night. this is a winner!",5,1,3,General,Dresses,Dresses
7263,7263,868,35,Very cute!,"This is such a great top! it runs huge though. i normally wear a small but bought the xs. it fits ok. i would prefer the xxs, but i bought it on sale and retailer is sold out. for reference, i am 5`6 and about 138 lbs. very flowy soft fabric, great purchase.",4,1,0,General,Tops,Knits
7264,7264,1078,57,Great casual dress,"I went back and bought this dress after a sales associate told me that it was super cute on but didn't look like much on the hanger. i'm 5'3"" and curvy and the s fit great. it will look great with boots or booties. it's very comfortable and nice quality material.",5,1,3,General,Dresses,Dresses
7265,7265,862,35,Flattering,"I like this top a lot, and have always liked knotted looks around the bust area. i do not have a large chest, and this kind of top always draws attention in all the right places. i was worried the cut would be too low for my comfort level-and it is low but the shirt does not come away from my body in normal movements so i do feel completely comfortable wearing this without a cami underneath. i don't prefer this in black because i think the color detracts from the bunches of fabric created by the",5,1,10,General,Tops,Knits
7266,7266,1078,33,I will live in this!,"Soft, comfy, great fit. this is the perfect cozy item for fall and winter. looks really cute with the sleeves rolled or cuffed slightly. the fabric is patchworked with linen and a terry/jersey material. i'm usually a medium and the medium fit great. slimming lines and does a great job of being swingy/flared, without that tent look.",5,1,3,General,Dresses,Dresses
7267,7267,867,39,Excellent standard for my wardrobe,"I purchased the black tunic. as others have mentioned, this piece goes great with skinny jeans or leggings. when i'm rushing to find something to wear, this is one of my go-to's. nice coverage. not see-through.",5,1,0,General Petite,Tops,Knits
7268,7268,1080,44,,"This dress is stunning in person, though the pictures do it no justice. it was overall a very clingy fit. i'm 5'3 with long legs and it was too short for me so i did not purchase, but would recommend it for those with short legs.",4,1,1,General,Dresses,Dresses
7269,7269,1078,42,Soft material,Great dress. looking forward to wearing it with tights. fits great.,4,1,1,General,Dresses,Dresses
7270,7270,867,55,Awesome!,"Good quality, cute and great color as pictured. perfect for leggings or tight ankle pants.",5,1,8,General Petite,Tops,Knits
7271,7271,867,44,"Good tunic, great marigold color","Drapes very nicely and runs true to size. easy to wear alone or layer a jacket/cardigan over. i purchased this on sale, and it was a good buy. i am 5'8"" and purchased the size m, as i am a pretty true size 6.",5,1,1,General Petite,Tops,Knits
7272,7272,862,28,Simple and chic,"I was afraid the twist at the front would be too bulky, but it adds a nice extra touch to an otherwise simple shirt. i got it in the blue and the color is beautiful. a basic piece with a little bit more; very happy",5,1,0,General,Tops,Knits
7273,7273,1035,47,Disappointed,"Although i bought 2 sizes down from my regular size, they were still big and, made my derriere look flat. i would have kept them as weekend kick-around jeans, but the flat behind just made them a must return.",3,0,0,General Petite,Bottoms,Jeans
7274,7274,1035,51,Love these jeans!,I am so glad i did not miss out on these jeans. i am new to pilcro and am finding they fit me so well!,5,1,0,General Petite,Bottoms,Jeans
7275,7275,867,69,Love,Got this in the gold and it's so much better than i imagined. runs longer on my 5'4 frame than on model but i love this extra long look with white fitted pants and heels. total classic easy elegance and comfortable too.,5,1,6,General Petite,Tops,Knits
7276,7276,862,45,Lovely,"I wasn't sure how the knotted front would look on me, but it lays perfectly. very comfortable, well-designed, flattering top in lovely rich colors. i'm normally a small-medium in retailer tops, but i got the large as it does run small and i don't like things too clingy. so best to try on in store rather than buy online. nice simple statement piece!",5,1,14,General,Tops,Knits
7277,7277,862,56,Love this twist-front tee,"Love the petroleum blue
unique twist design
love the sleeve length
perfect for work -- neckline not too low
great by itself or with a bib necklace and black jacket
absolute winner",5,1,0,General,Tops,Knits
7278,7278,1080,39,Overall loved but,"As others stated, it was a tad bizarre to have a mock neck on the spring dress, however, i would wear this in the fall with boots and a nice moto jacket. another ""but"" is i wasn't sure about the color. i am very pale and the pale color is pretty much my skin color... however, the blue flowers and black lace make up for it as far as colors, and everyone liked it on me. lastly, cut: wow, this was just really nice on, very flattering,. i usually try on regular size in store and order petite, but th",5,1,1,General,Dresses,Dresses
7279,7279,862,39,Nice blue,"I finally tried this on now that it went on sale, and it was surprisingly flattereing. love the blue color, and i assume the purple was equally nice. fit is true to size as in i tried on the regular xs and it was great, long but ok for me,",5,1,2,General,Tops,Knits
7280,7280,862,27,Great shirt,"Great shirt that runs true to size. i got the turqouise color which is very pretty. it cuts lower, but doesn't show much cleavage.",5,1,0,General,Tops,Knits
7281,7281,1078,43,Much better in person,"This is such a fun dress. the linen and cotton mixture is very unique and comfortable. for reference, i am 5'3"" and about 110 pounds. the regular xs hits me exactly the way it is shown in the photo. the color is a true oatmeal which is so nice for fall and even though i am fair with strawberry blonde hair, it doesn't wash me out. the sleeves are a little long but i rolled them once and it is perfect. i love this dress and it will look great with booties or boots for the fall.",5,1,5,General,Dresses,Dresses
7282,7282,862,38,Love it!,"I love the way this looks on me! definitely flattering on curvy/full-figured girls. i am a 36-38c and bought an xl - i don't like things that are too tight or that cling to the wrong areas. if they had xl in other sizes, i would buy it in every color. can be dressed up or down. i'm very happy with this purchase.",5,1,0,General,Tops,Knits
7283,7283,862,60,,Beautiful top. works wonderful on hourglass figures.,5,1,9,General,Tops,Knits
7284,7284,862,39,,"Great top for day to night. fine for work (i'd think large breasted girls may find it too gaping for work as mentioned, but b cup and below doesn't gape so very work appropriate.)",5,1,0,General,Tops,Knits
7285,7285,862,33,Beautiful top,"Upon opening this top, i thought for sure it was going to be too s mall, but it stretches nicely and is gorgeous when on. it is a little thin, and you have to be careful that it's not too tight or you can see skin through the knots, but i love this shirt. i got the xs, which is my usual size. i could probably have used the s, but didn't want to pay for shipping to exchange it as i don't have a store anywhere near me and the xs was fine.",5,1,0,General,Tops,Knits
7286,7286,867,56,"Simple, light","This is a simple, light-weight tunic top. the construction is fine. overall, i'm happy to see a basic executed well.",5,1,10,General Petite,Tops,Knits
7287,7287,1025,29,Finally olive skinny jeans!,"These jeans are exactly what i was looking for. love the rich olive color. these are definitely an olive green and not a brown color, which i was very happy about. fit is great, i am 5'7"" 150 athletic hippy build and a size 29 fits great. they are the perfect ankle length jean. very soft, and just the right amount of stretch.",5,1,1,General,Bottoms,Jeans
