,Serial_No,Clothing ID,Age,Title,Review Text,Rating,Recommended IND,Positive Feedback Count,Division Name,Department Name,Class Name
6001,6001,873,38,"Stylish, hip, & professional",I absolutely love this top. i thought it was going to be to big but it fits perfectly. fitted and flattering.,5,1,0,General,Tops,Knits
6002,6002,873,35,,,3,1,0,General,Tops,Knits
6003,6003,1086,47,Great day dress!,This is my favorite kind of neckline. it is very flattering & cool for summer. my only complaint is the armpit scoops down a little too low. but i will just wear a bandeau underneath it. its super cute. will be great for vacationing & next summer.,5,1,0,General,Dresses,Dresses
6004,6004,873,52,Not as cute in person,"Per the other reviews i sized up and got the medium. it was still tight around the girls (and i'm not that well endowed), but too big in the armholes. the fabric is a kind of thin tee shirt material. i kept it (because i'm lazy) but not sure how much i'll wear it given the strange fit.",2,0,0,General,Tops,Knits
6005,6005,873,29,Love this top!,I love how it fits very flattering! the quality of the cotton part of this top is a little less in quality of that fabric than i expected. but i love this top and i foresee wearing it all year round!,5,1,0,General,Tops,Knits
6006,6006,873,34,Great tank just not for me,The sizing and length are great had it not been for my chest area. i sized up from my usual medium but the pleats create a maternity look for me unfortunately. it truly is a great tank top!,3,1,0,General,Tops,Knits
6007,6007,525,36,Great fit,This is really a nice piece. briefs have nice coverage and more of a hipster but you can also easily pair the top with just black briefs. i only sent it back because the tankini style pushed up my love handles and didn't look quite right but for many others it would work nicely.,5,1,0,Initmates,Intimate,Swim
6008,6008,873,47,Adorable,"This top is adorable ,i finally broke down and bought it,so happy i did fits good,not too long sits at hip were it should (very flattering) i went with the reviews and sized up,i am a petite sx normally in retailer,but went with what the reviews said and got a reg small glad i did!it is a bit snug(not tight) in the chest,but has stretch to it , i am 5'1 108 33d (if you are bigger in the chest i would recommend a medium,) i got the purple motif (print) no see thru issues,the material is a comfortab",5,1,0,General,Tops,Knits
6009,6009,873,70,Very cute top for the summer.,"The top is adorable, but probably better to wait for a sale as the full price is a little high for a simple top like this. i got the print one and it's very true to size.",5,1,0,General,Tops,Knits
6010,6010,873,39,Great peplum top,I love the fit of the peplum top. it's flattering without being too full on the bottom. the print is lovely and great for summer and spring!,5,1,0,General,Tops,Knits
6011,6011,1101,53,"Flattering, even on my curvy figure","Normally i would never try on anything with horizontal stripes.... but for some reason, i saw it in my store and gave the dress a try. fit is perfect, and dress is lined. (side note: my store had the navy dress and the stripes are horizontal and not diagonal as pictured on the model- dress looks like the ivory dress.) can be dressed up or down, so ill be a great summer go to dress. i am a curvy girl and because of the different widths of the stripes the dress works and is very flattering. i'm ve",5,1,25,General Petite,Dresses,Dresses
6012,6012,873,56,Nice top!,I ordered my usual size small in this top (34c) and it just fits across the chest. very cute top.,4,1,0,General,Tops,Knits
6013,6013,873,26,Good staple,My normal size m fit well but i wouldn't want it to shrink any. hangs well.,5,1,0,General,Tops,Knits
6014,6014,873,33,,,5,1,0,General,Tops,Knits
6015,6015,873,27,Perfect shirt for all occasions,I absolutely love this top! i bought it in white and ended up buying it in the lavender as well. the top is very flattering and works with any occasion. the fabric is a little thin but its fine with a nude bra. i have worn the top to work and out at night and i always get lots of compliments!,5,1,1,General,Tops,Knits
6016,6016,1030,39,Great jeans! size down.,"I am really happy with these jeans. fun fit, high waisted, great detail, and have just the right amount of stretch. i have worn them 4 times and haven't washed them yet (i find this helps shape my new jeans) and they still fit like a comfortable glove. a different twist on the ripped up jeans because of the color! love them! i normally fit a 29, ordered 28 in these and they are perfect!",5,1,0,General,Bottoms,Jeans
6017,6017,1101,51,"Wanted to love this dress, but...","When you look at the online pictures of the navy colored dress, the stripes are diagonal. however, that is not the case with the dress in person. the stripes are all horizontal and not that flattering. such a bummer because i love maeve dresses and thought this would be a great addition to my summer dress rotation. alas, not very flattering, so back it goes.",2,0,9,General Petite,Dresses,Dresses
6018,6018,873,20,Would wear it every day if i could,"Absolutely fantastic top, the cut is very flattering and the colors are gorgeous in the pattern (i also bought the white).",5,1,1,General,Tops,Knits
6019,6019,873,41,,,4,1,0,General,Tops,Knits
6020,6020,873,73,Gorgeous top,"Went to the chicago michigan ave location and found this gem in the ""take a peek"" section... i think that's what it's called.  anyway... been looking for a plane white top to wear with a red lace pencil skirt and this fit the bill! wore it today with a grey midi skirt and sneakers and looks adorable!  it does flare a little and makes me feel like i'm wearing a maternity top but i don't care i love it!  went back to another retailer location and purchased the lilac one! can't wait to wear that one",5,1,0,General,Tops,Knits
6021,6021,850,30,Cute but a little awkward.,"I adore this blouse, but the cut is a bit weird. the shoulders fit snugly and the body is blousy/boxy. the colors are super cute and the cutouts are unique but i don't think this top is for everyone.",3,1,0,General Petite,Tops,Blouses
6022,6022,850,32,"Versatile, great spring color","I ordered a size 4, my usual size in tops is s or xs for looser fitted tops, i prefer a more fitted look. for reference i am 5'4"" 120 lbs,, 32d. i ordered in pink and the color matches the online image. the pink is shear and i do have to wear a camisole underneath, which does not bother me at all. the top is adorable with jeans or slacks for work.",5,1,0,General Petite,Tops,Blouses
6023,6023,1004,39,Great skirt,"My hips are very narrow and i don't have much of a waistline. in a-line skirts and anything that sits below the waist, i wear a size 6. skirts like this with a defined waist almost never work for me because of the waistline. if this is typically your style of skirt, i think it will run large because the waistline is more generous than usual. 

 i tried it on in the store today and bought it in a size 8. it's very comfortable and cute and will be easy to pair with different things.",5,1,0,General Petite,Bottoms,Skirts
6024,6024,850,50,,"I really liked this top when i saw it in yellow but i was on the fence about ordering it for a while. when i did order it i chose the pink at the last second. i love it. i've worn it several times with a pair of jeans and cardigan. it travels nicely in the suitcase, no need to pull the iron out. i wear a cami underneath but it's really not that sheer so you don't need to. it's a lovely piece",5,1,0,General Petite,Tops,Blouses
6025,6025,1110,35,"Lovely, a little large","The print is beautiful, the fabric has a nice weight. i actually bought this because i'm early in pregnancy and wanted a dress i can wear during the transition period - because of its swing shape, this is one of those rare dresses that looks good on me now and will still look good on me in 6 months when i've got a huge belly.

fit-wise: i am 5'9, 155 lbs, 34d, and ordered a large, but i am exchanging it for a medium. the arm holes are also a bit large.",5,1,0,General Petite,Dresses,Dresses
6026,6026,873,57,,"Very nice quality!! awesome style, the fabrics is so soft but very durable!! this top will be great with jeans or a denim skirt!!",5,1,2,General,Tops,Knits
6027,6027,873,40,Great summer top,I gave this in her brighter rose colored print and love it! i get many compliments on this top! i did size up from my usual small to a medium to accommodate the girls :),5,1,0,General,Tops,Knits
6028,6028,873,23,Pretty blouse,"Made of casual materials, perfect for drinks or to be used as a vacation top. has a very flattering cut and pretty design with chiffon trim on top.",5,1,0,General,Tops,Knits
6029,6029,850,35,Simple and elegant,"I thought this shirt was really feminine and elegant. only downsides is some of the punched out holes had fabric still attached which you have cut off with scissors- otherwise the shirt will snag. and the second issue of bigger importance are the low armholes. lots of bra showing- not really sure how to get around that so i always wear it with a cardigan. but it would be nice not to have to. 
other than that it looks nice and pairs nicely with almost anything.",5,1,0,General Petite,Tops,Blouses
6030,6030,873,38,Lightweight,This top is perfect for summer. it delivers style without the bulk. the peplum hit perfect for my 5'4 frame. unfortunately it was too low cut in the front. i had to return it.,4,0,1,General,Tops,Knits
6031,6031,873,28,Very flattering top,"This shirt is very flattering, which is not the case for all peplum tops. v-neck is appropriate for work. looks great with jeans or khakis. highly recommend! only con is that the material is quite thin. 5'3"" 115 lbs and xs fit perfectly.",5,1,0,General,Tops,Knits
6032,6032,839,60,Cute top,Purchased this top at my local store. usually don't pay full price for clothing but had to have this top. so cute and lightweight. love that you do not need to wear a cami underneath and has material that covers your bra. usually wear a petite size due to tops being cut so low but a regular medium was perfect. suggest purchasing this top full price or if still around when it goes on sale definitely purchase. i bought the floral design.,5,1,0,General,Tops,Blouses
6033,6033,873,27,Cute peplum top!,"I tried this on in-store. it is super cute! i am waiting for it to go on sale because i wasn't sure it was completely worth the price. if you are in-between sizes, take the larger size.",5,1,0,General,Tops,Knits
6034,6034,1110,39,Runs big,"I bought my usual size medium and it's huge on me. if i sized down, my chubneck wouldn't be comfortable. the buttons are frustrating. the color, the pattten, the style are 100% gorgeous! i think i will belt mine",4,1,0,General Petite,Dresses,Dresses
6035,6035,873,46,Cute top,"Great material, pattern and cut. perfect summer top",5,1,0,General,Tops,Knits
6036,6036,873,31,Adorable layering piece for spring,"I love this top! i ordered the print, and it will go perfectly with blue or white jeans, and even coral shorts. very flattering. i did go up a size (from xs to s) based on other reviews, and i'm glad i did. the larger size fits perfectly at the bust and falls just below the hip.",5,1,0,General,Tops,Knits
6037,6037,873,56,Comfortable & fun,Fun pattern which goes with just about anything. cool for summer.  very comfortable.  fitted style but true to size.,5,1,0,General,Tops,Knits
6038,6038,873,27,Patterned peplum top,"Adorable! very pleased with the quality of the fabric and the very comfortable fit. i'm sure i'll wear this with jeans, as pictured, but can also see it with a breezy summer skirt.",5,1,3,General,Tops,Knits
6039,6039,873,52,So much potential,"But, saldly, no....i tried the multicolored version in a size m and l. the fabric is almost good, though a touch sheer and perhaps problematic for washing. the real issue, though, is the fit.
fyi: 36c, broad shoulders/back, high waist
i typically wear a m in a knit top, but the waistband was tight and not forgiving. i think that the problem was that this is a top with a long waist. when i tried to put the waistband where it wanted to be (longer) it made the peplum stand out in an odd way from my",3,1,11,General,Tops,Knits
6040,6040,873,35,Cute and comfy,"I was nervous about buying this without trying it on, but i followed the size chart and wasn't disappointed! it's flattering thanks to the fitted upper-half and the forgiving peplum bottom-half. overall, it's thin, light, and airy.",5,1,0,General,Tops,Knits
6041,6041,873,35,Such a cute top,"I was so excited to get this top in the mail. i loved the colors, print, cut, everything. i put it on and was so disappointed, the top looks so much better on the model. i don't know if i should have gone down a size (i go between an xs and s), but it looked terrible on me! my husband took one look at me in it and said that's being returned. still disappointed",1,0,0,General,Tops,Knits
6042,6042,839,64,Adorable top,I ordered my usual size 6 in tops at retailer in both the orange/blue print & the pink color. fit is tts & looks pretty much on me as in the pic. lightweight & cool for these hot days. the 'pink' really is not pink - it's a true orange so i returned this one. i didn't really need an orange top. if it had been as in the pic which is a pink/coral-like color i wld have kept it. the orange/blue print is really appealing so that is a keeper. this top is a little flowy but not tent-like which is perfect,5,1,16,General,Tops,Blouses
6043,6043,850,30,Pink is brighter,"Just note the pink is different than in the photos. much hotter/more saturated. apart from that surprise, overall i'd recommend. nice design.",4,1,0,General Petite,Tops,Blouses
6044,6044,895,41,"Why don't you look good on me, lovely cardigan?","This cardigan is so pretty on the hanger! and it's a lovely color and the pattern on it is just beautiful.

but somehow it just doesn't suit me. i bought it twice, the second time on sale, hoping it would look better on the second time around.

nope. the deep v neckline and the cut of the body just makes me look really flat-chested and ""meh.""

back it goes. again.",4,1,0,General,Tops,Fine gauge
6045,6045,850,65,Lacy cutouts/ flattering shape/ versatile,"I ordered this lovely blouse the moment i saw it, and i am very pleased that it is the quality and fit i'd hoped for. i bought the medium in pink. i am 130#, 34f, size 8 or medium on most tops. the medium fits me perfectly; i love the gathering at top back so that there is no pulling at all across the back or bust. i am mystified that all blouses aren't designed with a nice level of gathering to accommodate a bust and to give a flattering flow.. i am busty so awkward tightness can be a problem o",5,1,26,General Petite,Tops,Blouses
6046,6046,873,30,Great tank,"Love the fabric, print, and cut! it's a smidge low in the neckline, but that's probably because i'm busty. nice and breezy for our blazing hot and humid florida summers.",5,1,0,General,Tops,Knits
6047,6047,873,49,"Pretty colors, nice fit",I love the teal/aqua version. the colors are very pretty and look great with jeans. i got a medium. it runs a tiny bit small but a lot of fitted tops at retailer run smaller on me. i like the style a lot and the peplum is great.,4,1,0,General,Tops,Knits
6048,6048,1101,39,Off the shoulder?,"This dress references that it is off the shoulder in the description. but i did not find it to be so; it fits me as pictured on the model - sort of a ballet neck or wide scoop neck. in any case, the fabric is as pictured. and - it's lined! yay - not see through. the varying sizes of stripes give it interest despite the neutral colors. it is cute with a denim jacket and is really comfortable.",5,1,23,General Petite,Dresses,Dresses
6049,6049,873,40,Great layering piece,"I was looking for a flowier top to wear under cardigans, and this is pretty perfect. it is more sheer than i would like, but because i am wearing it as a bottom layer, i'll overlook that. the fit is great and the peplum is a cute detail to make this layering piece a little different.",5,1,0,General,Tops,Knits
6050,6050,873,52,Great top,"Love this top - on sale, i bought two of this color, a grey and the green, i never buy more than one of anything unless i absolutely love it ! complimentary to the body, and the colors are beautiful. i'm 5'2"" there were no pxs so i opted for xs, perfect... thanks retailer ??",5,1,0,General,Tops,Knits
6051,6051,873,28,Runs small,"Purchased on sale, would have never purchased at full price. runs small and runs short. will be returning.",3,0,0,General,Tops,Knits
6052,6052,873,39,The print is interesting,"I kept this one because it was different enough and good to wear casually and to work. i'm not sure how this material will hold up with washing, since it's basically a thin cotton material. it fits perfectly, so i'm worried that it will shrink. i give it a thumbs up for the design, but sale cost and material is like something you would find at forever 21.",3,1,0,General,Tops,Knits
6053,6053,873,20,Awesome!,Love the design (i got the blue and green one). it was more see-through than i thought but the pattern covers it so it doesn't matter what color bra you wear.,5,1,0,General,Tops,Knits
6054,6054,873,48,Cute top,It's a very pretty top. a little tight in front at the bust. i'm giving it 3 stars because the fabric is very flimsy and looks cheap.,3,1,0,General,Tops,Knits
6055,6055,985,26,Color transfers to other clothes!,"I really loved this vest online and decided to try it on in store. it was really cute on and fit nicely so i purchased it (in my normal size) and took it on a vacation. first time wearing it and the color transferred all over my white shirt even though it says it is pre-washed. i am very disappointed considering how expensive this was. overall, it is very cute but it may ruin your clothes so beware!",2,0,19,General Petite,Jackets,Jackets
6056,6056,1092,39,Must get!,This dress is amazing! the photos do not do it justice! runs a tad large - definitely can size down.,5,1,2,General,Dresses,Dresses
6057,6057,1110,45,Say yes to this dress,"Unique, sophisticated and versatile summer dress that you will fall in love with. dress it up with heels for a night at the gallery or dress is down with a denim jacket for an easy day look. it needs no accessories. this silk dress is soft and it lays beautifully. you will want to wear it all summer long. fits tts. love it!",5,1,6,General Petite,Dresses,Dresses
6058,6058,985,28,Beautiful,"I ordered the copper in a medium which i felt was tts (5'4"" 145). the color is beautiful and i love the buttons on the shoulders which i really didn't notice in the picture, the material is also very soft. but i have some complaints.. first i felt that the material, while soft, was not very substantial for the price. i purchased another vest from that store that has everything which was $100 less and seems to be the same quality. i also was expecting there to be some way to close the vest beside",4,1,8,General Petite,Jackets,Jackets
6059,6059,823,23,Really poor quality,"This shirt is purportedly made of silk, but it is extremely low quality. the material is coarse and scratchy. it's not even worth it at the extra 40% off sale price. returned.",1,0,1,General,Tops,Blouses
6060,6060,1059,40,,This is my favorite purchase so far! i am in love with this jumpsuit. it it fitted on top and has a flowy dress feel on the bottom. i got this on sale recently and if you can grab it do it! you won't be disappointed.,5,1,0,General,Bottoms,Pants
6061,6061,1110,34,,"When i saw the dress online i thought the print was beautiful and fun, and was not disappointed when the dress came in. the material is very soft, breathable, and easy to wear. i dress it down with a jean jacket or a jean vest but it can easily be worn by itself. it's definitely a delight go to dress for the weekends.",4,1,0,General Petite,Dresses,Dresses
6062,6062,985,26,Fun spring accessory,"This vest is adorable! i love the color, it goes well with almost anything. the drawstrings work great, some days i cinch them a little tighter for a more fitted look. honestly, i wear it at least once a week - out with friends or even to my job as a nanny. i was a little worried about the length of it because i'm tall, but it works perfectly with my build.",5,1,0,General Petite,Jackets,Jackets
6063,6063,1081,40,,"This is a lovely dress - however, there is a weird flap of fabric under the bow that doesn't sit right. it feels a little like a bib. if i could get it to sit right, i would keep it. every angle of the dress is lovely except for head on - which is a small problem.",3,1,1,General Petite,Dresses,Dresses
6064,6064,891,53,Nice cut,"The poncho style sweater has is a light airy cotton fabric ideal for a extra layer but certainly not warm, the hook and eye attaching the arm to the sweater is not ideal, i had to have a seamstress sew it and remove the hook, its just not practical that way, happy with purchase,",4,1,0,General,Tops,Fine gauge
6065,6065,828,27,"Tight sleeves, overly blousy top","The sleeves were very tight in the upper arm area but the body was blousy, too blousy so to go up a size for the arms would mean it would be very oversized in the body. i like the fabric (nice and thick) but it did not work for me.",3,0,8,General,Tops,Blouses
6066,6066,828,41,Perfect for fall!,Super soft flannel material. the colors are beautiful and perfect for fall! it's doesn't ride up the shoulders but stays in place off-the-shoulder style. i love it!,5,1,0,General,Tops,Blouses
6067,6067,828,52,Perfect,"Love this top.  i get compliments every time i wear it.  got the medium. fits perfect. 5'4"", 138#.  even at my age it looks great.",5,1,1,General,Tops,Blouses
6068,6068,1110,63,Slik dress,The perfect dress for dinner date or summer weddings. or traveling. love this dress. not sure on washing yet since it is a silk dress. extremely comfortably and beautiful. i can't recall the last time i bought a new dress.,5,1,17,General Petite,Dresses,Dresses
6069,6069,1110,37,"Cute dress, but do not wash! dry clean only.","According to the label, this dress can be hand washed or dry cleaned. i hand washed and line dried per the instructions on the label, and all the seams have completely shrunk and gathered. it looks like there's a drawstring running through every seam. so disappointed in the quality and the labeling. awful! i gave it one extra star because it's cute.",2,0,3,General Petite,Dresses,Dresses
6070,6070,828,46,Test like fit,"This shirt was tent like on me and there was really no way around it. i am fairly small- usually a 4 or 6 in tops, and smaller on top- barely 34b. this top was incredibly unflattering, falling to cut right at my hips and sitting open and way too flowy-- like a pillowcase/sacklike fit. there was just too much fabric here to make it work for me. it's unfortunate because it looks adorable in the product photo and i love the plaid mix with the open shoulders- a nice transition to fall. unfortunately",1,0,0,General,Tops,Blouses
6071,6071,985,39,Like but not love,"If you are looking for a nice vest, this vest is nice enough, comfortable, and soft. the cut is also flattering, but i just didn't think it was as special as i wanted. it looks like many other options out there, so i decided to pass.

xs fit me at 115 lbs.",4,1,1,General Petite,Jackets,Jackets
6072,6072,1092,39,Sbags easily,"I liked this dress but wasn't sure about the color on me. i tried it on anyway. originally, i tried on the 0, but it seemed big so i ordered the 00. also usually i order petite, but this dress is already short (and i am not getting younger), so i went with regular size this time. color was not bad on my pale skin, i think the hue was ok (surprisingly). one thing that might bug the perfectionist in me, the zig zag isn't always aligned, the waist, for instance was crooked, but if it is like that e",5,1,5,General,Dresses,Dresses
6073,6073,1110,29,Isn't she lovely?,"This dress makes my heart skip a beat. it's beautiful, soft and colorful. it's a lovely midi length which can be tricky for 5'5"" lil ole me but it's perfect. it has slits up the side for an easy breezy look. the fabric is so silky & pretty form fitting if you buy the right size. i'm a solid 4. have bought heaps of dresses from retailer and i can't stop, won't stop.",5,1,0,General Petite,Dresses,Dresses
6074,6074,828,25,A fresh take on flannel!,"I am in love with this top. flannel shirts are a fall staple, but i don't own any. any flannel shirt that i have come across has been a button down, which simply does not work for me, given my chest size. i hate button downs that gap or that i have to leave unbuttoned and wear a tank underneath. it's not flattering. this top is flannel, no buttons, and off the shoulder, which is such a unique and fresh style. the off the shoulder feature stays in place thanks to tiny straps sewn in that you put",5,1,0,General,Tops,Blouses
6075,6075,1110,61,Great dress!,"Comfortable, great fit and beautiful colors. the interesting thing is that in this picture, it shows the dress just below the knee. i am 5'5"" so totally average height, but the dress falls just above my ankles., which i personally think is way more attractive. not sure if there are two versions of this dress, but be careful if you buy online. i got mine in the glendale store.",5,1,0,General Petite,Dresses,Dresses
6076,6076,828,54,Love it!,"What a great, soft piece for fall.  the top is flattering and comfy at the same time. it looks really romantic with the bare shoulder look.",5,1,1,General,Tops,Blouses
