,Serial_No,Clothing ID,Age,Title,Review Text,Rating,Recommended IND,Positive Feedback Count,Division Name,Department Name,Class Name
4707,4707,836,61,A piece of art,"Stunning! very well made. the colors are so vibrant and stand out without being too flashy. the cut is a bit strange but it works. runs true to size. i took my normal size 0. i rarely buy anything at retailer full price, but i made an exception with this one. a must buy!",5,1,3,General Petite,Tops,Blouses
4708,4708,836,42,Not right for every body type.,"I have a 36c bust. i bought this blouse in a 10, even though i wear an 8 or 10. i sized up based on previous reviews. this top was super tight in the bust (it literally flattened my breasts) and very loose on the bottom. it was not flattering at all. the material is gorgeous. it is thick. it is lined. it is darted at the bust and it flares out in a peplum fashion where the light fabric up top meets the dark band of fabric in the middle. the problem is that busty ladies will find the bust area wa",3,0,3,General Petite,Tops,Blouses
4709,4709,836,38,Loving it,Adorable peplum top! colors are much more rich in person. saw it in the store and stalked it online until it went on sale. beautiful material and craftsmanship. i thought it ran on the large side though wish it was a touch longer but not enough to not purchase. highly recommend....great piece to dress up or down and easily add layers for fall.,5,1,1,General Petite,Tops,Blouses
4710,4710,836,34,Like wearing a beautiful painting,"The retailer by me actually had this and i had to try it on. my thoughts below:
___________
pros:
- well-constructed with lining underneath to avoid the need of a cami or tank. no see-through issues whatsoever.
- the fabric is great quality and looks nicely sewn. no fraying or strays seen on the 2 sizes i tried.
- there's a back zipper that goes from top to bottom at the back. unusual as i don't see why that's needed since you can just slip it over your head.
- front ""v slit"" isn't too low or reve",4,1,78,General Petite,Tops,Blouses
4711,4711,826,62,Gorgeous,The most beautiful top in my closet and i have a huge closet of beautiful clothes! hope retailer carries more peasant top by this brand...stunning,5,1,0,General Petite,Tops,Blouses
4712,4712,836,46,Shirt is beautifully made,"Sadly, this shirt was too short for me. i'm 5'11"" and have had a hard time with some of retailer's shirts lately. but it is absolutely beautiful and the fabric feels expensive and it's well made.",4,1,1,General Petite,Tops,Blouses
4713,4713,836,49,Pretty tank,"It is a pretty tank, the fabric feels nice and substantial.",4,1,0,General Petite,Tops,Blouses
4714,4714,1027,42,Runs two sizes small,"Nice fit and color and i love the tall cuff but you will need to size up at least two sizes.  as the previous reviewer stated these jeans do run extremely small.  i usually wear a 27 ag in jeans, sometimes a 28 for the ag legging jeans but the 28 in these were still very tight all over, and uncomfortable.  i don't like my jeans skin tight so i had to go up to a size 29 but they fit and look great.  sizing definitely off on these.  i am 5'3"" 115# for reference.",5,1,3,General,Bottoms,Jeans
4715,4715,836,38,Triangles aren't my shape,"So, i want to start off by saying, the quality of this shirt really was great. as was the pattern, unfortunately if you're going off the picture know that they definitely pinned in the sides on the model. this shirt has a full on triangle shape and flares significantly towards the bottom, it's not a straight fit as the picture would suggest. i'm sure this works for some women but if you're muscular with an already v-shape to your body (meaning your shoulders are significantly sized and you have",2,0,0,General Petite,Tops,Blouses
4716,4716,836,35,,"Bought this on sale in my reg size- 10. im 5'9"" and about 36c. the fabric is heavy and pretty. this is a more formal top in my opinion. it is lined. it is much wider around the waist than appears on model. zips up the back, but i can pull on and off without unzipping.",4,1,2,General Petite,Tops,Blouses
4717,4717,1100,35,,"I was really pulling for this dress to work because it's beautiful, however the neckline is cut so extremely low that i had to return. it's much higher on the model than in real life. the petite length was still far too long, so additional hemming required, otherwise fit was true to size (5'3, 130 lbs, size 6p)",3,0,4,General Petite,Dresses,Dresses
4718,4718,1076,65,,"I love how different this dress is in terms of the design. it catches light beautifully. the short, biased hem makes the dress fun and flirty. but, this dress is completely sheer. there is no lining which is very disappointing. i do have a short, nude slip that makes this dress work for me. you will need a slip, for sure! unless you are rhianna. the sizing runs a little large, i probably could size down given the loose cut but overall the proportions are flattering showing off my legs. i will re",3,1,0,General Petite,Dresses,Dresses
4719,4719,1080,31,Wonderful dress that can be dressed up or down!,I bought this dress in a medium petite. i'm 5'2 and 140#. it fit great and made my waist look really tiny. i cannot wait the dress with heels or else you would see the entire shoe. it works perfect with flat sandals. i've received tons of compliments! you can also wear a normal bra with the dress. love it!,5,1,0,General,Dresses,Dresses
4720,4720,381,31,Lovely one piece,"This is a beautiful swim suit! the overall look is lovely; the ruffle is sweet and the low-cut front keeps it just the right amount of sexy for a one piece. i didn't keep it only because i would have preferred the leg opening to be cut a little higher. otherwise, it fit very well. i'm 5'10"" and 150, with broad shoulders and a substantial rack (nursing a baby right now) and i didn't have any problems with support. great buy!",4,1,1,Initmates,Intimate,Swim
4721,4721,381,38,The 1 piece,"A must have 1 piece. every time i wear this i get compliments! it's very flattering, amazing quality, soft material, good support and vibrant colors! i wish this came in more colors and patterns. worth the money no questions asked!",5,1,3,Initmates,Intimate,Swim
4722,4722,1080,29,Cute,I like this dress. very nice easy to wear everyday dress. the top is lined but the bottom is a bit thin and unlined. i don't think it was too sheer though. it seems much of the quality of retailer is going down a bit. disappointed overall in the quality of their dresses this year.,4,1,1,General,Dresses,Dresses
4723,4723,381,46,Beautiful and flattering,"I ordered this in the china pattern color, and the colors are vibrant and beautiful! the suit is well made and slimming. there are no bra cups; just a shelf bra, but the tie halter adds some extra support. i have trouble buying bathing suits, but i am very happy with this one.",4,1,8,Initmates,Intimate,Swim
4724,4724,933,62,"Great quality, but odd fit","When i saw this, i ordered immediately thinking it was similar to the popular colorblocked stripe sweater from last year. the knit is stretchy and textured and feels like great quality (would wash well), but it's pretty lightweight. the fit is huge...could easily size down. i'm 5'7"" 128# and found the small to be loose everywhere, including the arms. the length was at my knees, and the stripe fell awkwardly across my chest. no idea what i'd wear this with even if it fit better. sadly, it's going",3,0,1,General,Tops,Sweaters
4725,4725,1080,62,Keeper!,"I adore this maxi! the fit, style, pattern (black motif), machine washability, everything! fits tts (got my usual size s for 5'7"", 125lbs). i would say that the length is appropriate - some are super long on me, and i'm not one to wear heels. i was also happy that the top fits nice and snug - my issue is usually that when i bend forward the top drapes open due to my small chest - no problem with this dress! i think it's perfect piece for spring/summer/fall and dressing up or down. my one slight",5,1,6,General,Dresses,Dresses
4726,4726,1080,30,Great maxi,"I agree with another reviewer. the neckline is just right, not too low cut and a normal bra should work fine. also it would be nice if this dress were lined. the top part has more than one layer so that's not an issue, but the skirt doesn't so i'll likely wear spanks. other than that, it's a great maxi and perfect for spring or summer (light weight)..",4,1,6,General,Dresses,Dresses
4727,4727,381,29,Flattering suit!,I ordered this after reading the stellar reviews and i was not disappointed! i ordered the black and purple floral motif and both are excellent. i have a rather big chest (36dd) and the shelf bra and halter support are just enough for me. look forward to wearing this on my upcoming vacation!,5,1,2,Initmates,Intimate,Swim
4728,4728,999,33,Just what i was looking for!,"This skirt is great! the fabric is so soft and light. i was hoping that the lower portion of the skirt wouldn't be too transparent, and it wasn't. the slip lining on the upper portion of the skirt is nice. the color is exactly as shown. i followed the advice of the only reviewer and sized up... i shouldn't have! the skirt was too big in the waist and too long. so i exchanged and the fit was right on. i think the skirt is meant to sit a little higher on the waist, so keep that in mind. the only t",5,1,2,General,Bottoms,Skirts
4729,4729,1080,39,Comfy whimsical,"Love this black and white dress. the bottom art print is so nice, i am a sucker for flowers, i also love the cut of it, teh tiered hem is very flatering, not too much amterial. the upper part covers a normal bra, and the whole dress is super flowey, substantial amterial, and stretchy (for those days where you ingest more than itnended). flattering cut (waist being the aame apttern as the bottom, gives it a nice shape). i can't say anything bad about this. 

regular xs fit me but i would ahve t",5,1,9,General,Dresses,Dresses
4730,4730,1080,41,Absolutely amazing,This is such a simple dress to throw on that will give you instant wow factor. you can dress up or down but know that it is completely flattering - head to toe. i am in love with this dress!,5,1,1,General,Dresses,Dresses
4731,4731,1100,28,Very pretty dress but runs big,"Beautiful print and a flattering cut. however, the proportions are off. based on other reviews, i ordered a petite (i am 5'4"" and don't normally need a petite cut). i also ordered a size down. even the 0 petite requires that i wear 3-4 inch wedges and pin the top in the back to keep it in place. i am going to take it to a tailor to have the hem shortened and the top sleeves adjusted...then maybe the v neck won't be almost to my belly button.",4,1,1,General Petite,Dresses,Dresses
4732,4732,381,30,Not for the busty babes!,"Loved the material and the style. unfortunately, my fears came true when i received this swimsuit, and there wasn't enough support despite a review i had read. as a 36d, i thought the halter would be enough support, however, the material is too stretchy to rely on that completely. i am sad i won't be keeping this though. the material is heavenly!!!",2,0,4,Initmates,Intimate,Swim
4733,4733,1080,38,Love!,"Great petite maxi! i'm 5'3 and it skims the top of my feet. soft, fits great and went right into my suitcase for my upcoming  trip. can dress up or down.",5,1,0,General,Dresses,Dresses
4734,4734,1080,44,Lovely!,"I was on the fence about getting this maxi because it's a tad pricey but ended up scoring an retailer coupon that took a bit of the sting out of the price. i'm so glad i went ahead and ordered it! it's absolutely lovely! i'm 5'3"", 117# and got an xs petite; it fits like a glove and is the perfect length to wear with either flats or a higher heel. love, love, love!",5,1,0,General,Dresses,Dresses
4735,4735,273,39,Terrible buy,I wouldn't be so unhappy if these pants cost about 75% less. they are so cheaply constructed. one wash and they're all but guaranteed to shrink. the material is so cheap and flimsy not at all what i expect from retailer. they are also 32 inch inseam not 35.5 as stated on the web site which is the whole reason i bought them.,1,0,10,Initmates,Intimate,Sleep
4736,4736,1080,32,,Very comfortable and easy to dress up or down. i get tons of complaints on this dress- it's a definite win!,5,1,0,General,Dresses,Dresses
4737,4737,1080,24,Great petite maxi,"I ordered this dress online and i love it! i'm only 5'2"" so it's always a challenge for me with maxis but this one fit the bill. not too much fabric to be overwhelming on a shorter frame and the length was perfect. the fabric is very comfortable and moves with you. also the quality is great! i ordered a small petite but i probably could have gone xs petite. this would dress would be flattering on most people. need same dress, more colors!",5,1,2,General,Dresses,Dresses
4738,4738,1080,38,Cute maxi,"The material is nice and has a lot of stretch. i ordered the small as i'm a 6 in most dresses. it fits comfortably  i could probably get away with xs but have a large chest so was afraid it wouldn't cover me. i'm 5'2"" so a petite might be a bit better but it was sold out. i'll have to wear tall wedges with this one.",4,1,0,General,Dresses,Dresses
4739,4739,1100,32,Love!,"This dress is beautiful and fit exactly as pictured. i'm 5'9"", 140 lbs and a size 4 fit perfectly.",5,1,4,General Petite,Dresses,Dresses
4740,4740,1080,60,,,5,1,0,General,Dresses,Dresses
4741,4741,1076,35,Scratchy and boxy,"For me, this looked better in the picture. i found the actual item more garish in person, and way too scratchy (on the outside) for my liking. hard pass for this petite.",2,0,3,General,Dresses,Dresses
4742,4742,1080,32,"Lovely dress, fits well","This dress is very forgiving on my post baby body. i'm glad i purchased the petite, it hits my ankle perfectly (i'm 5'5""). very versatile, i can see wearing this at work (with a blazer) or on a weekend.",5,1,1,General,Dresses,Dresses
4743,4743,1080,33,Fantastic buy!,"This is my new favorite dress! i can't tell you how flattering it is. i just had a baby a few months ago, and it's the only piece of clothing i actually feel like i look like my old, pre-baby self in! i'm on the shorter side (5'3""#, very busty #because i'm nursing# and about 118 lbs. i got a mp and it fits great. i could have gotten the small, but i feel that would have been too low cut. honestly, love the cut, the pattern, everything about it. would buy again!",5,1,0,General,Dresses,Dresses
4744,4744,862,54,Oddly fitting top,"I was disappointed in this bordeaux top, a brand i usually enjoy. i ordered a medium, my usual size in their tops. it was very very big and did not fit at all as pictured here. also, the fabric is somewhat sheer and while i tried it on wearing a darker bra, the combo of being way too large and a bit sheer was enough for me to return it.",3,0,11,General,Tops,Knits
4745,4745,1080,44,Go to dress,"I love my new maxi dress! as soon as i put it on, i knew this dress would be my go to dress of the summer. i love the styling with the thicker shoulder straps and higher cleavage. you will definitely be able to wear a regular bra with this dress. the material is soft, light, and flows well. i particularly love the ruffle on the bottom of the dress - it adds that extra little feminine touch. i can't wait to wear it.",5,1,0,General,Dresses,Dresses
4746,4746,1080,40,"Cute but missing some ""oomph""","I think it's a cute dress, but nothing spectacular. that being said, i get a lot of compliments. it's a very flattering cut, but i wish it was more colorful, not just black and white. i'm 5'10, 145 lbs and got the s, i could have probably gotten the xs too, but i'm happy with how the s fits. great length too, since i often have a hard time finding dresses that are long enough for me.",4,1,0,General,Dresses,Dresses
4747,4747,1080,27,Beautiful and comfortable,"I love this dress! my goal is to have a closet full of clothes that are really cute and stylish, but are also very comfortable... this dress fit the bill. the mixture of the fabrics is even more cute in person than it looks online, and the fabric is so soft, it almost feel like wearing pajamas. the weight of the fabric also makes it hang really nicely, and so it's flattering. overall, a great addition to my spring/summer wardrobe.",5,1,2,General,Dresses,Dresses
4748,4748,1080,37,Great maxi!,This is a great dress for summer and very flattering!  i am 5'4 and could have pulled off the regular length but chose to go with the petite so that i could wear flats.,5,1,0,General,Dresses,Dresses
4749,4749,1080,33,Lovely,This dress is beautiful. the neckline is not too low and the straps are wide enough so you can wear a normal bra! the waist is very flattering and the ruffle at the bottom is not too much. i am short so i ordered the petite and it is a perfect fit. now i just need some warmer weather!!,5,1,17,General,Dresses,Dresses
4750,4750,1080,35,Awesome dress!,"One of the best maxi dresses i have ever found! i needed a dress that could accommodate a large bust (36g) and camouflage my postpartum belly. the dress did it all. i ordered the large (5'7 and 155 lbs) and it is so flattering. it has just the right amount of coverage up top to prevent looking too busty. and the band around the midsection makes me look much slimmer. like i said, best maxi dress ever. price is pretty high, but it was worth it!",5,1,4,General,Dresses,Dresses
4751,4751,1080,44,Perfect maxi dress,"I love this dress. i live in maxi dresses versus shorts in the summer and this is the perfect cut, weight and quality. i did have to order it in petite or else i was stepping on the bottom (unless really high heels). i am 5'5"", so i would say that it runs long. offer this cut in more colors!!",5,1,2,General,Dresses,Dresses
4752,4752,1080,45,A perfect dress,"This dress is extremely comfortable and looks great on. i'm 5'3"" and 34dd and the m petite fit like a dream with even a bit of room at the bust. the length is perfect with sandals or even up to 2-inch heels. perfect for travel and summer entertaining!",5,1,0,General,Dresses,Dresses
4753,4753,1100,38,Much lower top,"I'm 5'8 128lbs and bought a size 2. i loved this dress, but didn't expect to have to go bra-less or wear a tube top under. the top lands much lower than i expected but the rest of the dress was lovely. 

i ordered a size 2",3,0,2,General Petite,Dresses,Dresses
4754,4754,999,59,Only one problem- length,"Beautifully made. beautiful drape. deep  blue. so long tho i have to role it up at the waist so nix on tucking a white blouse in. why is it so long???? in 5'6"" and got a large. with 2 inch heels i still trip and not about to wear really high herls. 
ill keep it tho because its a nuce dressy skirt. may take it to be hemmed but the last item i got hemmed ended up an uneven mess",3,1,0,General,Bottoms,Skirts
4755,4755,1080,35,Even more beautiful in person!,"I was on the fence about purchasing this dress for a while and finally took the plunge. glad i did because this dress is stunning and very comfortable. i ordered an xsp and it was the perfect length. originally, i had also considered xxsp. while it fit well above the waist, it was slightly too short. for reference, i'm 5 ft 3.5 inches, 105 pounds.",5,1,0,General,Dresses,Dresses
4756,4756,1080,53,Beautiful and flattering,"This dress is wonderful. wide enough straps for a bra to be concealed, lovely pattern that draws the eye down instead of across, and a waistband that hits at the narrowest part of your midsection, making it look super-tiny. the design is simple but very clever--it's feminine, flattering, and slimming. my only quibble is that it's quite long (and i'm almost 5'7"" in my stocking feet)...i will have to wear heels or have it hemmed. highly recommend.",5,1,0,General,Dresses,Dresses
4757,4757,1028,45,Great jeans!,These are so comfy! mom of two boys on the go! great for running around and then can be dressed up for a night out on the town! not mom jeans!,5,1,0,General Petite,Bottoms,Jeans
4758,4758,381,28,Lovely little number,"Took the plunge and ordered this in the romantic floral pattern. i almost got the black because i thought it would be 'timeless' but the print is so fun - i'm glad i went with it! ordered a size m - for reference, i am 5'6, 135lbs, 34c, 28/39 and the fit is comfortable. i don't need a lot of support :) and i find the coverage adequate up top and on the bottom. i think it'll still fit perfectly even if i lose a few pounds before my beach trip. this is the first one-piece i've had since i was a gi",5,1,7,Initmates,Intimate,Swim
4759,4759,1080,40,Love this dress!,Another perfect maxi from retailer! the print is feminine and can be easily dressed up or dressed down. i ordered my normal size in maxis (medium) and the top fits nice and snug but not too tight. i am busty and the neckline is high enough that i don't feel like i am showing too much cleavage. it is a little long on me when i have flip flops on but with a little platform sandal it will be perfect.,5,1,3,General,Dresses,Dresses
4760,4760,999,53,A basic for my closet,"Love this skirt. i love that it is pleated and sheer on the bottom. i'm so happy i found it online! love anything maeve, you can count on the quality and simple elegance.",5,1,0,General,Bottoms,Skirts
4761,4761,1100,36,Pretty dress with problems,"I'm 5'4"", 32c and 125 lbs. i ordered the size 4p and while the color and fabric is pretty, the back and front bodice were much to low to wear a bra even if i were to shorten the straps. it was also very tight across my ribs. despite ordering a petite, the hem was much too long. i ended up returning it.",2,0,0,General Petite,Dresses,Dresses
4762,4762,1080,39,I look taller!,"Gorgeous dress with a slimming pattern and flattering waistband. i would say the bust cups are a little floppy on the medium petite and i have 36dds. like others, i wish the skirt was lined but it's not a deal breaker. tracy reese did a great job creating movement in the skirt and flounce without the bulk. i can wear a little heel but wearing flats makes the hem drag.",5,1,0,General,Dresses,Dresses
4763,4763,1080,40,"Beautiful, flowy summer dress",The cut is wonderful and the fabric is soft and flowy. it is pretty sheer so a slip is recommended. i wish this dress had a lining like some other dresses i've gotten at retailer.,4,1,10,General,Dresses,Dresses
4764,4764,381,46,Ruffled halter maillot,Bought this for my girlfriend and she couldn't be happier! she's a size 4/34c and the small fits perfectly and is so flattering and comfortable. highly recommend.,5,1,1,Initmates,Intimate,Swim
4765,4765,999,36,Great maxi,I've been looking for a versatile maxi skirt all season. the pleats and layered look were a great effect to a really basic navy maxi skirt. the waist is elastic (great for after baby) and will look good with a shirt tucked in and belt. the only drawback is that it's a little too long and will drag on the ground if i wear flats (i'm 5'7''). soft material with some flowy movement when you walk.,4,1,2,General,Bottoms,Skirts
4766,4766,1080,29,,"As other reviewers have said, this is the perfect summer maxi dress! i'm tall, just under 6 feet, and while the dress could be just a bit longer it still works for my height. i do wish the skirt was lined, but other than that the dress is excellent. worth buying at full price if you're worried about it selling out!",5,1,1,General,Dresses,Dresses
4767,4767,1080,22,Beautiful classic dress!,"I can't get enough of this dress! this dress is everything. from the flattering fit, to the colors and pattern, to the design, and to the quality.. this dress really has it all. this is worth every penny and in my opinion, a great price for a versatile, high quality dress. the material is that super comfy, stretchy material which is perfect for everyday! it is a no brainer and easy to throw on. also, the neckline is flattering and sexy without showing ""anything""! definitely can wear a normal bra",5,1,0,General,Dresses,Dresses
4768,4768,1080,39,Beautiful!!,This dress is so easy to wear! the neck line is not too low! can wear a regular bra!! it flows beautifully! i love it!!,5,1,0,General,Dresses,Dresses
4769,4769,1080,47,Beautiful dress!,"This dress is so much prettier in person - the pattern is unique, adorable and not over-powering. i'm an xxs petite and i can wear the dress with flats. (5ft) i think this is versatile enough to wear to work, party or a casual wedding. the fit is perfect - hugs at the correct spots. the fabric feels really soft and silky and feels a bit heavy which allows it to drape nicely. overall - i love it.",5,1,2,General,Dresses,Dresses
4770,4770,381,59,Breastfeeding friendly,"I'm on the smaller end of the bust spectrum even nursing i'm a 32c/d at my fullest. i adore this suit. there is zero support so if you need that move on don't buy this. i love it -hides the post partum baby puff, pattern detracts from flaws, deep plunge is modest yet still sexy and it's super stretchy and easily be pulled aside to feed a baby. underneath there's a fabric bra insert so if you bend over nothing can be seen which i like. haven't worn in water or waves yet but fabric feels awesome.",5,1,7,Initmates,Intimate,Swim
4771,4771,1080,61,Perfect dress,"This is the perfect dress to take traveling. dress it up with heels or down with sandals. warm up and wear it with a short black sweater. a nice easy elegant dress. size small fit nicely, medium probably would have been fine too.",5,1,6,General,Dresses,Dresses
