,Serial_No,Clothing ID,Age,Title,Review Text,Rating,Recommended IND,Positive Feedback Count,Division Name,Department Name,Class Name
4500,4500,1038,41,So unique and so comfortable!,"I love these jeans! when i saw them in my retailer store, i instantly fell in love. they fit like a dream and they look so much better in person than online. they're definitely a boyfriend fit, so if you're between sizes, go down a size. i've already gotten tons of compliments!",5,1,1,General,Bottoms,Jeans
4501,4501,1038,50,Very nice...,"These jeans are beautiful. as the other reviewers have noted...they run very large...like 2 sizes, even then they are very stretchy. the embroidery is dark blue (looks black on screen)....lovely pair of jeans. if they had other colors i would by them!",5,1,0,General,Bottoms,Jeans
4502,4502,1095,53,Wanted to love this dress,"I love the look and feel of  this easy dress. i loved that it comes with a baby blue slip, however i was in between sizes. the medium - a bit too small and the large- just too big. this dress is probably best in a tall thin body type, especially in a madras plaid.",3,1,0,General Petite,Dresses,Dresses
4503,4503,1095,55,Get it before it's gone girls!,"I'm 5'7 and 137 pounds and i tried on this dress in the store. i got the small as it has a little more material in the medium and the small fits like a glove. this dress is great quality and feels good, looks good and can be dressed up or down. like the model in the picture i like the flats with this dress. high quality fashion and total comfort on a hot summer day. go anywhere with this dress and you look like a million dollars. one more little hidden detail it has a detachable slip underneath",5,1,2,General Petite,Dresses,Dresses
4504,4504,937,37,Not as expected,"I stalked this sold out product for weeks hoping my size would become available. when it did, i was very excited, in fact i ordered both a s and xs to be sure one sweater would fit me! unfortunately, neither did and i felt the actual sweater was not as pictured. the sweater has an overall baggy fit and the cutouts don't fall as neatly and as evenly on both shoulders as the picture shows, making the look a bit sloppy in my opinion. it is such a shame as this look is very of the moment and the mod",1,0,1,General,Tops,Sweaters
4505,4505,1038,53,Very unique jeans,"These jeans are very unique thanks to the embroiding. would have perferred colorful embroiding though. they are boyfriend cut, but not slouchy. just a bit loose even around athletic legs. they run true to size, but have a lot of give. after wearing them for a a little bit i catch myself pulling them up a bit. if you want a snug fit and are between sized i would go down a size.",4,1,10,General,Bottoms,Jeans
4506,4506,1095,73,Perfect summer dress,"I ordered this dress on a whim because of the lush colors and the sale price. to my amazement, it has become one of my go-to dresses. it is far more handsome and flattering in person. i ordered a m for my 5'9"" and 36c frame and the fit is perfect. contrary to how the back of the dress is shown on the model, the back is not straight, but flows whimsically thereby adding to its famine appeal. at this price, it's a no-brainier purchase.",5,1,0,General Petite,Dresses,Dresses
4507,4507,1095,59,Just great,"If they still have your size, grab it. fits a bit snug in chest, but material is light and airy. got so many compliments on it. great style",5,1,1,General Petite,Dresses,Dresses
4508,4508,1086,37,Love it!,Love this dress! the material has a softness to it - just love it! can't wait to wear it this summer. fits true to size.,5,1,0,General,Dresses,Dresses
4509,4509,1095,36,Love it!,"I actually ended up buying two of these dresses. i took the first one to the dry cleaner and they chewed up the slip and put a hole in the dress. i was so sad that i went and bought a second one before they could sell out. the good news is that it was on sale! this is an awesome light and airy dress that is great for those hot summer days. i pretty much wear it every opportunity i get. for reference i purchased the small. it's loose but the shoulders, armholes and slip all fit perfectly. i weigh",5,1,1,General Petite,Dresses,Dresses
4510,4510,1095,39,Surprisingly cute,"I wasn't going to even try to see it this dress would fit.  it just seemed like such an unflattering silhouette since my body is nothing like the model.  i'm so glad i gave it a try because this dress is cute and comfy and looks great on me when i belt it!  my outfit is a floppy straw hat, skinny leather belt and flat sandals.  there's a lot of fabric but it gathers well without poofing out.  i ordered the medium petite and i am 5'3"" 36dd 140#.",5,1,1,General Petite,Dresses,Dresses
4511,4511,1095,49,Fun!,"This is my go to, cool, summer dress. it's very light and airy and extremely comfortable. great for 90 degree days!
highly recommend!",4,1,0,General Petite,Dresses,Dresses
4512,4512,1086,31,Very happy,Love it! perfect casual look with a jacket and booties,4,1,0,General,Dresses,Dresses
4513,4513,1095,39,Classic comfort,I fell in love with this dress immediately. gorgeous print and colors. light and breezy. classic and comfortable. the petite length is perfect for my height and hits a few inches above the knee. i have a small bust (34a) but a wider rib cage so the petite small was a perfect fit. couldn't be more pleased with this purchase.,5,1,0,General Petite,Dresses,Dresses
4514,4514,1086,31,Classic and comfortable,Love this dress so much. it's super comfortable and i always get a ton of compliments every time i wear it. the fabric is the perfect weight not too heavy. i'll be wearing this all summer long.,5,1,0,General,Dresses,Dresses
4515,4515,1095,35,A steal at sale price!,"I love this dress. i don't have many pink things but saw someone in this on instagram and had to have it. it is as comfy as a nightgown. it has pockets! i tried it with brown sandals as well as with a dark jean jacket and taggart grey booties and looks cute both ways. also looks great with a blingy necklace. tts- got my normal med and it's roomy, but not too big.",5,1,1,General Petite,Dresses,Dresses
4516,4516,829,50,Very blousy but still cute,"I love the length of this - no danger of explosing my muffin-top! the fabric is super cute - good weight, pretty color. i got a medium which is a bit blousy - i think i could have gone with a small.",4,1,1,General,Tops,Blouses
4517,4517,1111,34,,"Gorgeous dress. it was designed to accentuate a woman's figure. lovely material, holds everything in place without being too revealing. the dress does not lose its shape. definitely a head turner",5,1,0,General Petite,Dresses,Dresses
4518,4518,820,37,Shrunk terribly!,"I bought this top in the store, which was good because i ended up wearing a size smaller than i usually do. i loved the flowy fit of it. the washing instructions say machine wash cold, tumble dry low. i washed it on cold and hung it to dry. it shrank to the point of being unwearable (the dreaded button gap!) and lost its softness. i hope the store lets me return it.",2,0,3,General,Tops,Blouses
4519,4519,1110,24,"Cute, but bad fit.","The waist is a little high and large, and this causes gapping in the small-of-the-back area. very cute dress, if it fit well. would probably work on someone less curvy. 00p, 5'4'',110lbs,32c for reference.",4,0,0,General,Dresses,Dresses
4520,4520,820,45,Love this blouse!,"This is one of the best purchases f
i have made at retailer recently. i got this in ivory in my usual xs. the pictures do not do it justice.  it has such a nice drape and i love the detail on the back.  looks great with black cropped trousers, as well as skinny jeans.",5,1,0,General,Tops,Blouses
4521,4521,820,53,Love it,I bought this shirt along with a matching vest and duster........love it!,5,1,0,General,Tops,Blouses
4522,4522,820,57,"Love, love, love it!",This top fits well as expected for the size. i love the ease of the top and wear it both casually and a bit more dressed up. great styling on the back.,5,1,0,General,Tops,Blouses
4523,4523,829,52,Cute shirt,"I bought this at the retailer store the other day and i wore it to work and i received so many complements. it has the perfect amount of swing and hides your middle without looking frumpy. i got the blue color and wore it with skinny jeans and ankle boots. the red is really more of a bight pink color, not a rich red as pictured. i wish it came in more colors and patterns...maybe green or purple? it does run big, i usually take a large, but a medium was perfect.",5,1,1,General,Tops,Blouses
4524,4524,1078,38,,,5,1,0,General Petite,Dresses,Dresses
4525,4525,830,57,,"Lovely top, very rich looking, i always get compliments. it's loose fitting but not baggy and the embroidery is well done.",5,1,2,General,Tops,Blouses
4526,4526,820,31,Great staple piece!,"Great fit and quality. i'm 5'3"" and 130 lbs, size 4 fit perfectly. bought both the blue and black. could definitely dress up or down!",4,1,0,General,Tops,Blouses
4527,4527,820,42,Light and flowing,"I am normally a 4, but they only had the white in size 2, so i tried it. i was pleased to see that it worked out just fine because it is meant to flow, therefore has plenty of fabric. it is very graceful and very pleasant to wear. i don't know how to explain it, but i had to take a second look when i saw it on the photograph because i was not sure it was the same blouse. much better in reality than on the picture.",5,1,1,General,Tops,Blouses
4528,4528,820,42,Not a white background,"Love this top. it's everything all the previous viewers said....except that the white isn't white but a creamy white.it has a yellow under tone.. this restricts my over all plans,but i still like it.",5,1,4,General,Tops,Blouses
4529,4529,863,31,,"Nice lines, just a bit tight if you have larger / more muscley shoulders.",3,1,0,General,Tops,Knits
4530,4530,495,39,See-through shorts,"I really wanted to love the shorts.  when i read that the shorts were lined, i expected them to be lined so that my underwear didn't show.  even though the shorts are lined, you can see through the fabric completely.  this was absolutely disappointing since the shorts have a lovely exterior design; pockets; and, comfortable waistline.  i'm returning the shorts as well.",1,0,2,General,Bottoms,Shorts
4531,4531,820,35,So many compliments,"I have so many compliments on this blouse. i love the style and design. i wear it with my long cotton skirt because it runs a little short since i have a long torso and i am 5""8 tall. i would love to wear it with my skinny pants but then it won't look right in the back kinda hang out. otherwise really nice quality blouse. i would definitely buy another just to have a back up.",5,1,0,General,Tops,Blouses
4532,4532,820,45,,,5,1,0,General,Tops,Blouses
4533,4533,801,39,What's with the pockets?,"The one i tried on had something wrong with the pockets... one was regular height,t eh other was so low, i could barely put my hand in it. however, the jumpsuit itself is really pretty and soft. color is nice, but hard ot pull off on pale skin like me.  i tried on the xs, but that was big. i would need xxs p if it was made in that size, so i let it go... (looked nice with pinched fabric in the back.

for reference i am 115 lbs, 30 dd< 26.5 in waist.",3,1,0,Initmates,Intimate,Lounge
4534,4534,1078,30,Pretty and versatile,"I was a little hesitant about this dress at first because it looks a bit baggy on top on the model. but decided to order it online anyway based on reviews. well i must say, i'm so glad i did! i really love the shape of this dress. i'm heavy on top but it somehow minimizes that and it also accentuates my waist. the dress is very well made. if you order the right size for you, the slip dress will stay in place. i'm going to style it with high black platform heels, but i also like it with boots as",5,1,0,General Petite,Dresses,Dresses
4535,4535,1078,33,Don't miss it!,There isn't anything i don't love about this dress! get it before it's gone! i get compliments every time i wear this dress.,5,1,1,General Petite,Dresses,Dresses
4536,4536,1110,49,Looks better on me!,"For once, the dress looks better on me than on the model. mine is tight above the bow and black/grey. my bow isn't this big?not pulled so much and maybe it's not knotted in the photo. it's heavy canvas and doesn't show my flaws. i'm saving it for summer?can't imagine wearing it as a jumper as in the photo.

for me (5'3"", 32e, 125 lbs) the bust is slightly tight in a 6 but the shoulders are a bit wide in an 8, but both look good. mine is not petite and hits me above the knee (6).

the dress is co",5,1,4,General,Dresses,Dresses
4537,4537,820,26,Great top,I tried this in store and fell in love. i'm usually between a 0 and a 2 in tops and took this in a 0 because of how flow and lose this is. the fabric is light and not bulky so it can also be tucked in.,5,1,0,General,Tops,Blouses
4538,4538,830,55,Cute top,"This top is really cute and can be worn off shoulder or not.  the embroidery is really pretty.  my only comment would be the top is shorter than i expected, if you wear it off shoulder its of course longer but still shorter than i would have preferred.  keeping it anyways as it will be a fun going out casual top.",4,1,0,General,Tops,Blouses
4539,4539,1187,35,Cheaply made but flattering cut,"This is the perfect peplum. it floats a bit but doesn't stick out and is super flattering. that's why i kept mine even though the front seams were like an inch off, and the peplum pleat is crooked. geeze retailer. this is why i can't justify buying much of anything unless it's on sale. quality in recent years has gone wayyyy downhill.",3,1,5,General,Tops,Knits
4540,4540,829,65,Great top,Super soft and comfortable with a flattering fit. love the tiny buttons and the 3/4 sleeves since many times the sleeves are too long for me. already my favorite fall top.,5,1,4,General,Tops,Blouses
4541,4541,820,35,Super cute!,"I was a little hesitant to order this, thinking it would be too large and unflattering but thankfully i was wrong. this shirt is super cute and comfy. it is a bit of an oversized fit but the fabric drapes nicely and is quite flattering. my new go to outfit this fall will be this shirt with the sleeves rolled up, ankle jeans and my fave oxfords. i'm 5'3"", 115lbs and went with the size 4 regular",5,1,0,General,Tops,Blouses
4542,4542,820,55,,"I fell in love with this shirt the moment i saw it!
unfortunately, when i went to put it on, there was a hole running down the seam in the back. i went to store to exchange, wore the shirt, and someone tells me i have two holes in the back of my shirt. horrified, i went home, took a look, both holes along the seam! i will be returning this, i really liked this shirt!",2,0,0,General,Tops,Blouses
4543,4543,829,36,Just ok,"I love good, flowy blouses and like the over sized look, but this one didn't wow me. i thought the quality was just ok. it didn't flatter me. i almost liked it, but i didn't. i'm glad i tried it on, because looking at the pics online i thought i'd like it way more than i did. just not great.",2,0,0,General,Tops,Blouses
4544,4544,1078,35,Pretty fabric,"Such pretty pattern and colors, pleased with dress",5,1,0,General Petite,Dresses,Dresses
4545,4545,820,29,Soft and fun,"This shirt is very soft and fits nicely. as with a lot of maeve tops, the arms are a little snug so if you have muscular arms you'll definitely want to size up. it won't make the shirt too ""blousey"" because it will still look really cute tucked in in the front with ankle jeans and a trendy belt. i wish i had gotten this in the blue before it sold out because it is lovely!",5,1,0,General,Tops,Blouses
4546,4546,820,34,Odd cut,I loved the star pattern of this top but the cut was odd. it is very big in the chest and full at the bottom. for anyone who is petite on top it tends to look sloppy.,2,0,0,General,Tops,Blouses
4547,4547,820,46,Love this shirt!,"I bought this in both the black motif and the ivory. i got a size 2 and i would say it is true to size. the fabric is very comfortable and doesn't wrinkle easily. it does have a ""flowy"" look to it but i didn't find that it had too much fabric. i wouldn't tuck it in though. i find it looks really good with skinny jeans/pants and i love throwing a cardigan over it for cooler days. the details in the double buttons and on the back are really cute and make it more unique. i recommend the shirt.",5,1,0,General,Tops,Blouses
4548,4548,829,51,Not for me,The quality of this shirt is great and the colors are pretty. it just made me look super wide. i feel like the waist is too high - not quite empire and not quite at the waist. it just wasn't going to work for my body. maybe a different size would work but i don't like it enough to try.,3,0,1,General,Tops,Blouses
4549,4549,820,33,The perfect button-down!,My expectations were blown away in the best way when i tried on this top.  i typically have issues with button-downs in the chest area (buttons never lay flat) and this top lays perfectly.  the material is super soft.  looks great buttoned all the way up or with a few buttons left open.  i can't wait to wear with a pair of black high-waisted jeans this fall!,5,1,0,General,Tops,Blouses
4550,4550,831,30,Beautiful - the first time you wear it.,"This top was gorgeous and fit perfectly right out of the bag, with only a quick ironing. unfortunately, the first time i washed it (cold water, hang dry), it shrunk so that it no longer fits across the bust without tape where it was once roomy, is much shorter, and feels rougher to the touch. like another reviewer said (unfortunately, after i had purchased and washed!), i wish the label would have just said to dry clean only, because i regret washing it and would have done otherwise if i had kno",2,0,1,General Petite,Tops,Blouses
4551,4551,820,59,"So soft, so versatile","Beautiful blouse that can be dressed up or dressed down. online shows as purple, but the black mortif is be true black background with pretty floral colors. i rarely wear floral design, but this blouse make it work. the material is such a soft rayon material. love, love, love.",5,1,0,General,Tops,Blouses
4552,4552,829,67,Must try on to appreciate.,"The first time i saw this in the store i passed it by because the fabric didn't appeal to me .... but the second time i tried it on and fell in love .... had to have it in the beautiful blue.  i'm busty 32h but wear a small and the gathers do wonders to camouflage, which was a nice surprise, because i usually avoid anything with fullness.  will look great with white or black jeans but i will also pair with a very subtle pattern legging as the length is perfect.  i'm short, 5'3"".  neckline is fem",5,1,2,General,Tops,Blouses
4553,4553,1078,34,Just as pictured,Love this dress! it's exactly as pictured and the fabric design is so pretty. will look great with a cardigan for fall but also will look nice for summer with the cutout in the back. nice too that it has a detachable slip.,5,1,0,General Petite,Dresses,Dresses
4554,4554,829,45,"Great fall top, may need to size down","I looked at this on the hanger and almost passed it up. i'm so glad i didn't because it ended up looking so much better on. i wear a s or xs in retailer tops and went with the xs. i'm 5'6"" and it still had plenty of room and enough length to cover my backside. i usually gravitate to reds but the red in this top, while pretty, had too much pink in it for me.",5,1,1,General,Tops,Blouses
4555,4555,820,32,Beautiful softness,"This shirt has an incredible softness to it and the purple print is so lovely, i did end up returning it simply because the flowiness was a bit too much for me. i had tried the 2 and 4 and went with the 4 due to arm restrictions in the smaller size. too bad because it really is a lovely top. definitely worth a try in store!",4,1,14,General,Tops,Blouses
4556,4556,50,45,,"These are soft and skim the body the way well fitted undergarments should. they do not pinch, bind, or ride up. they coordinate perfectly with the matching bra. i am very pleased with this purchase.",5,1,0,Initmates,Intimate,Intimates
4557,4557,820,59,Light draping style,"This blouse drapes and floats lightly like a dream. the dark black patterned top is not see-through which means you can easily wear it without having to layer. the length covers past your hips and the pattern is flattering.

the doubled-up buttons makes the blouse unique and it's comfortable enough to wear to work or with jeans from late summer into fall.",5,1,3,General,Tops,Blouses
4558,4558,820,49,Love it!,This shirt is wonderful! i love the styling and the print. sure to be a favorite!,5,1,0,General,Tops,Blouses
4559,4559,820,40,Great blouse,"I got the dark blue print which is a really pretty pattern. the fabric has a nice crinkly feel and the cut is very forgiving. i thought from the pictures it would be more of a traditional button down with straight lines. it actually is a looser fit but without the trapeze shape of some ""swing"" tops which i have found to be less flattering for those of us who are curvier on the bottom half. it's comfortable and flattering, could be tucked in or worn out and likewise dressed up or worn casually wi",4,1,0,General,Tops,Blouses
4560,4560,1078,34,,,4,0,0,General Petite,Dresses,Dresses
4561,4561,820,39,Really comfy and can be worn almost year round,"This is a super comfy and adorable shirt. got the black motif - it could def. be passed off as a dark/inkish navy color, too, so it's very versatile. it runs typical/tts for maeve (if you're unfamiliar with the brand, order up one or two sizes if you have broad shoulders and/or large arms). this is super lightweight; feels ""slinky"" for lack of a better word. essentially, it's rayon-gauze- but it is double-layered, so it is not sheer at all (no need for a cami, although in the lighter version i c",5,1,58,General,Tops,Blouses
4562,4562,831,26,Simple yet charming,"I really wish i could keep this top. the material is okay and i have noticed with this brand, shirts made from this material do not wash well or look that nice after a wash. if you have the time to dry clean then i would 100% recommend this top. another tip if you buy this (since i didn't read the description) the top has buttons all down the front. i am not a fan of button tops because i have a larger chest so i wouldn't recommend this top to someone who is busty.",3,1,2,General Petite,Tops,Blouses
4563,4563,1187,34,"Cute...but not ""amazing""","A cute top. the peplum seam hits me at the right spot on my waist. for my curvy figure, this isn't always the case. i also am drawn to tanks that i can actually wear a bra underneath without showing bra straps.
i usually vary between a medium and a large in deletta, but definitely needed a large.
i ordered the ""lavender"" color, which is disappointing; a dull gray. i've decided to return and order the coral instead.",3,1,2,General,Tops,Knits
4564,4564,820,44,Returned,I got the blue. it is very short. one side of the shirt i received was shorter that the other. the material feels cheap and pleats out a bit right over the bust - only flattering on small busted models.,1,0,0,General,Tops,Blouses
4565,4565,820,48,Super-delicate fabric,"I wore this for a few hours, and while it i got compliments i ended up needing to return it after the seams opened up over the shoulder blades. the fabric is so fine that during the normal goings-about of my day it gave way. and no, i didn't buy too small, and the fabric didn't pull while i was driving or reaching for anything.",2,0,1,General,Tops,Blouses
4566,4566,820,39,Beautiful blouse,"I bought the black motif, the design lends to a nice pop of color.  the venting detail on the back is beautiful, but probably not as obvious on the black.  maeve is one of my favorite retailer designers.  i'm usually between a s/m or 6/8 in blouses.  i followed advice from other reviewers and got the 8- for room in the arms.  the blouse is very billowy- much more than in the photos, but i'm wearing it with skinny jeans and i love it!",4,1,0,General,Tops,Blouses
4567,4567,820,34,Cute casual shirt,"I got this shirt as a gift. it's cute and very comfortable. it is,however, a little thin so you may need to wear something underneath.",5,1,0,General,Tops,Blouses
4568,4568,820,53,Shrunk after first wash,This item states you should wash in cold water and tumble dry low heat. it shrunk after first wash in cold water and i didn&#39;t even use the dryer. do not wash. real bummer..,3,1,0,General,Tops,Blouses
4569,4569,820,48,Good shirt,"I purchased this in blue. it has a soft fabric and seems well made. i have worn it several times and think it is quite comfortable. i bought one size up due to comments on the site, but my daughter thinks i should have stuck to the size chart.",5,1,0,General,Tops,Blouses
4570,4570,820,45,,"Easy breezy top that goes with so many outfits. i am petite (5'0'', 115lb), but like the longer look of a top, so went with 4r, thought that the arm holes would be too small if went with 2r. there is a lot of excess material around the sides...and back. i was tempted to return, but the armhole issue prevented me and it was so cute, i kept it. i think it will go through the a few seasons (seattle is unpredictable weather-wise...) and can be easily layered. i like the blouse...but don't love.",4,1,0,General,Tops,Blouses
4571,4571,801,44,Sleek and unique but not sure . . .,I think this jumpsuit is different! the xs fit well and the material is a pretty color but very soft. the store had it styled with a metallic scarf that really accessorized it well.  i thought it would be great for my date night but stopped short of buying because i just can't picture this worn to other outings.  it is very unique though so i just might be back to purchase.,4,1,0,Initmates,Intimate,Lounge
