,Serial_No,Clothing ID,Age,Title,Review Text,Rating,Recommended IND,Positive Feedback Count,Division Name,Department Name,Class Name
6282,6282,964,51,Failed to read vest polyester shearling-lined,"Failed to read website description that vest is polyester shearling-lined.that's on me.

beware: pockets decorative only.

runs a size small due to fact vest is polyester shearling-lined.",3,1,5,General,Jackets,Jackets
6283,6283,1075,60,Fabulous,"I love this dress ! my husband loves this dress on me !
i ordered on line, it did not come in my usual 4, and it was only in petite. i ordered the 0petite. it fits fine, a little shorter than expected, but i am 5'2"" so it is fine.
very well made and lined.",5,1,1,General,Dresses,Dresses
6284,6284,1111,24,,"Saw this online when it first came up and thought it looked lovely. i purchased a different pleated dress and decided i didn't need a second pleated dress. was at my local retailer and they had one pink dress in a size 4 and a blue in a 0. decided to try them both on. the zero actually fit perfectly and at the sale price i had to have it. the material is beautiful, little details like the ruffled hem are lovely. one i will wear for years. thinking about getting the link but the blue is lovely. i'm",5,1,1,General,Dresses,Dresses
6285,6285,1110,38,This dress is why i love retailer!!,"This dress is beautiful. it is not meant to be super form fitting so in my opinion it was true to size altho i could see how others may want it to be more so in which case, size down. it came wrinkled but they make it in petite so they are forgiven and the material is such that i'm not sure how it could be prevented.",4,1,9,General,Dresses,Dresses
6286,6286,902,44,Snags!,"Such a pretty fall sweater. nice fit. wore it once out shopping and it snagged :( had to return, sadly.",2,0,0,General,Tops,Fine gauge
6287,6287,902,62,,,5,1,0,General,Tops,Fine gauge
6288,6288,902,28,Snags!,"Snags very very easily.  i hadent even gotten to take the tags off and it rubbed against another item and snagged! so disappointed as it is a beautiful top, lovely color and beautifully detailed! i'm so disappointed i was hoping to keep it but will be sending it back.",3,0,0,General,Tops,Fine gauge
6289,6289,593,23,Gorgeous and socially conscious,"I was very hesitant about this. i read the previous reviews and thought oh no. the first time i saw it in person i was mildly disappointed because the material wasn't how i thought it would be. then i saw it up close, and i realized it was better than i thought. however, i didn't have time to try it on.

it wasn't until later when i saw it on someone else that i realized i was looking at a must have. i am so happy i purchased this. its beautiful and flattering and the colors are bright yet und",5,1,0,General,Trend,Trend
6290,6290,1110,41,So sad i had to return,"I absolutely loved this dress and when i received it, it was exactly the way it looked/fit online. the material is so pretty and the fit was amazing. it was a bit wrinkled, but i'm used to ironing things, so that didn't bother me. unfortunately, i had to return it though because of the color. i'm filipino, and this yellow just isn't flattering on someone with dark/tan skin. yellow is a tricky color for me to begin with, but this was more of a mustard yellow and just totally wrong for my coloring",4,1,0,General,Dresses,Dresses
6291,6291,964,46,,This is a wonderful vest! i love the lining!! keeps you nice and warm! i love the muted green color! the pockets are sewn closed but can be cut open at the stitching without ruining the vest!!,5,1,15,General,Jackets,Jackets
6292,6292,866,26,Beautiful top,I love this shirt but it was huge! i ordered a small and i was drowning in it. unfortunately i had to return it.,5,1,0,General,Tops,Knits
6293,6293,1111,27,Summer dress,"This dress is not form fitting and some might consider it a little ""shapeless"". however, the color is stunning, the quality is great, and its a great dress for a wedding where you want to stand out but not have to worry about anything too constricting. great for dancing the night away - the under layer and frill at the bottom are perfect. i am very pleased with this purchase!",4,1,17,General,Dresses,Dresses
6294,6294,1111,39,Nice color but...,"The color of this dress is gorgeous and i really wanted to love it. but, it was awful. i am 5'9'' and the length was fine. the problem is the lack of shape which made me look 50 - 100 lbs heavier than i am. it would make a great maternity dress since that is what it already looks like.",2,0,3,General,Dresses,Dresses
6295,6295,1110,41,"Good fit, ok material","This dress is a good casual summer dress. the material is thin and feels nice on. the dress was very wrinkled when it arrived but that came out very easily and the fabric doesn't really wrinkle easily after initial wash and steam. the color is very vibrant and the fit is loose. however, if you have a larger chest (i'm a 34c), the hook and eye closure dones come undone. overall a good purchase. it looks good with a belt as well.",3,1,0,General,Dresses,Dresses
6296,6296,1110,39,Yuck,"Awful color, horribly wrinkled and just a mess...so disappointed",2,0,1,General,Dresses,Dresses
6297,6297,866,40,Soo cute!,"I loved this dressy ruffle sweatshirt. i am long waisted and these often look too short on me but this one fit perfect and actually accentuated my curves in a good way as opposed to making me look ""puffy!""",5,1,0,General,Tops,Knits
6298,6298,841,28,Just doesn't fit right,"I wanted to love this sweater but it is a return. it is a very weird fit, very thick, rug-like material and unfitted. the shoulders are bulky, the top is big and the booty is small. i am 5'2"", 34c and typically wear a small. the arms were very long, way too long. i will say other than that the top was true to size, may look okay on someone who had a larger chest and a smaller bum!",1,0,2,General,Tops,Blouses
6299,6299,964,31,Cute and comfy,This is a real cute vest that is also soft and comfy to wear. love it!,5,1,0,General,Jackets,Jackets
6300,6300,866,49,Pretty but...,Very pretty top. however you absolutely need to try it on before ordering. fit well in the chest area but way too big in the sides - i looked pregnant. had to return.,3,1,0,General,Tops,Knits
6301,6301,1015,51,Tapestry skirt,"I found this skirt beautiful for year round wearing.  it's lined and tts.  i usually wear a size 4 and this fit well.  some might say it runs big but i like skirts to sit a bit lower on my waist and this gave me a good 2 inches in length.  i'm 5'3"" and 119# and it hit me just above the knee.  i paired it with the back tie embroidered top by akemi & kin because the blue of the embroidery in the shirt was beautiful with the blue in the skirt.  it will also go with a cropped creme turtleneck i have",5,1,0,General Petite,Bottoms,Skirts
6302,6302,1072,50,Love this dress!,"I love this dress. the length is great and the dress just feels great. the material is raw silk (which i love) and the sizing does run a tad large, but with the make of the dress. i can lose weight and still wear the dress. well made and the buttons in back are super cute.",5,1,1,General,Dresses,Dresses
6303,6303,964,25,,,5,1,0,General,Jackets,Jackets
6304,6304,1072,59,"Classy dress, husband loved it!","Love trying things outside my usual style, thought this might look like a sack but fell in love! looks effortless, easy to accessorize, dress up or down & comfortable. keeper! want to try it with platform sneaks for casual look.",5,1,0,General,Dresses,Dresses
6305,6305,902,36,,,5,1,0,General,Tops,Fine gauge
6306,6306,1072,61,Shorter arm length than pictured,"I ordered a size 4, my usual size is a 4 or 6. the tunic fit well through the torso, but the arm length was too short and hit just below the elbow. the sleeve interfered with arm bending and moving. i have petite proportions so the arm length of regular size garments is usually too long. i don't want to go up in size because the body of the tunic might be too roomy.",3,1,1,General,Dresses,Dresses
6307,6307,1111,54,Great swing dress,"Bought this in pink for a wedding this summer. the dress detail is noted as a ""swing silhouette"" & should be perfect for twirling on the dance floor. the bit of orange under layer peaking out from underneath is just the right amount of contrast to the bright pink. a pair of heels will make this dress look perfect!",5,1,1,General,Dresses,Dresses
6308,6308,854,61,,,4,1,0,General,Tops,Knits
6309,6309,964,30,Great vest,"This vest is super cute! i'm 5'5"" 120 and usually wear an xs at retailer, i have this in a small and it fits perfectly, fits snug when zipped, my usual xs would have definitely been too tight. would definitely recommend!",5,1,11,General,Jackets,Jackets
6310,6310,964,30,"Comfy, cozy....",This vest is super cute on. it definitely has kept me warm this winter.,5,1,0,General,Jackets,Jackets
6311,6311,866,39,Completely shapeless - massive!,"Completely oversized top, size medium was swimming on me.....boxy, baggy, shapeless -- what more can i say? even in an xs this would not have fit in any way like the photo, returned.",1,0,0,General,Tops,Knits
6312,6312,902,47,,This sweater is a dull off white color. it looks old fashioned. don't get.,1,0,13,General,Tops,Fine gauge
6313,6313,593,42,Petite please,"I tried this on in the store and the colors and fabric are terrific. it's very light-weight fabric but isn't see-through. the colors are medium in depth, not too bright. if you typically wear ""cool"" colors and avoid browns, you may be able to wear this because the brown is very muted. there's two strings inside that you tie around your waist to pull the bust of the dress in. i'm 5'4"" and 125 lbs, so there's simply too much fabric in the dress. i would have bought a petite. the tag says it's avai",3,0,6,General,Trend,Trend
6314,6314,1110,38,Way too big,This dress has a beautiful color and design. however it runs too big. i'm usually between size 2 or 4 on antropologie's cloths. i had to size down to size 0 to get a more fitted look like the model.,3,1,1,General,Dresses,Dresses
6315,6315,854,48,Boxy,"I found this piece very boxy and not very feminine. i tried to make it work but i just wasn't feeling it the material is thin and the design is boring. unfort, it wasn't for me.",2,0,0,General,Tops,Knits
6316,6316,872,35,Cute but ...,"I thought this top looked adorable. and the material was soft. tops like these don't usually look great on someone who is a little bit busty, it can make you look fat or like you're wearing maternity. but the real issue was the arm holes were large and seemed to gape a bit. it just didn't look flattering. even if you wore a cute, lacy bandeau bra, the way the material sticks out around the arm holes would still look awkward. too bad, since it is a cute top, and well made.",3,0,8,General Petite,Tops,Knits
6317,6317,938,35,"Great consept, didn't work on me","I really liked this cardigan when i saw it today. the cut and detail in the back is slimming and very flattering. i love the idea of the safety pin closure, and i really like how the model wears it in this photo-open with the pin on the side. when i saw this in-store, it was closed in the front with the pin, which i also like. i thought for sure the cardigan was also pinned in back when i saw it in the model, so it looked fantastic. however, when i tried it on myself, it wasn't quite the same.",3,0,17,General Petite,Tops,Sweaters
6318,6318,937,36,Comfy and stylish,"I purchased this jacket in a pxs, as i am 5'2"" and 110lbs. the sleeve length is perfect! the fabric is soft and lightweight, which is perfect for living in southern california. i don't feel any itchiness either. the rest of the jacket fits me perfectly and hits right at the top of my hips. 


there are two cute grommets on each side at the bottom by the hem, which add nicely to the look. i like how the sleeves are ribbed, giving it a comfy sweater feel. there's also two zippered pockets, whic",5,1,0,General,Tops,Sweaters
6319,6319,938,44,Great cardigan,"Great cardigan. love the tie on the back of the collar. excited i was able to get the blue on sale. definitely runs big, but the small fits me well!",5,1,0,General Petite,Tops,Sweaters
6320,6320,993,56,Beautiful!,"This skirt is so gorgeous. the picture doesn't do it justice. several layers of mesh. i am 5'10"" and this skirt is very long, which i love. so glad i found this in my size for such a great price. highly recommended..",5,1,0,General Petite,Bottoms,Skirts
6321,6321,831,47,Gorgeous and unique,"I ordered this shirt and was happy to see that it looks just like it does online -- i love the rusty orange and pale blue contrast with the navy. the navy blue underlayer is so flattering, and the sheer sleeves are feminine and lovely. the shape and pattern are forgiving. this brand is really hitting it out of the park these days. this blouse runs a bit smaller than some meadow rue. if you're between sizes (especially arm-wise), i'd order up. otherwise just get your regular size. the body is flo",5,1,0,General,Tops,Blouses
6322,6322,938,33,,"Love this sweater so much that i got it in both colors. got the size small, fits well and keeps me warm. the cream color is very functional. the blue color is beautiful and unique.",5,1,0,General Petite,Tops,Sweaters
6323,6323,938,62,Unique,"Gorgeous sweater, very unique, given as a gift so not sure how well it will wear",4,1,1,General Petite,Tops,Sweaters
6324,6324,872,57,Lovely color; beautiful detailing,"I am usually a size small and had to size down to an xsmall. as mentioned in another review, it runs large in the armholes and across the bust, which is why i'm counting off one star. the armholes are also cut in quite a bit, so i will wear either a strapless or racerback bra. i am fairly small busted and the gathers falling from the yoke lay nicely; however, i can see that it might not work for someone who is more amply endowed and that it might have a maternity look. that said, the detailing i",4,1,2,General Petite,Tops,Knits
6325,6325,938,37,,"Gave this to a friend as a gift.  soft, lovely.  she loves it.",5,1,0,General Petite,Tops,Sweaters
6326,6326,938,39,Very pretty and flattering,"I wanted to roder hte petite version, as it runs long, but they are out of the ivory. i put hte green-ish color in my basket, and may order it, but for now, i am hlding off as i have other nice seaters... so many choices.

long, warm, fun closure, falttering, and nice tie back detail.",4,1,1,General Petite,Tops,Sweaters
6327,6327,831,38,,I love this shirt. the colors are just as depicted. the material is gorgeous and the top is very flattering. fits true to size for retailer small (i'm normally a medium outside of this store).,5,1,0,General,Tops,Blouses
6328,6328,938,46,Very heavy sweater,I ordered the blue version in size xl. it looked just like the photos online. it fit true to size. the problem for me was the weight of the sweater. it was too bulky & uncomfortable to wear. the color of blue was nice. the knit wasn't very soft but wasn't scratchy either. i found a better choice from retailer so i returned this.,4,1,0,General Petite,Tops,Sweaters
6329,6329,872,46,Pretty ivory tank,I ordered a size xl in ivory. it's prettier in person. there are great details. it shrunk a bit after washing and air-drying. i cut off the layer of chiffon around the neckline to make it more comfortable. a cute summer tank.,4,1,0,General Petite,Tops,Knits
6330,6330,1059,65,Terrible butt sag!!!,"These are horrible pants!!! they run small in the thigh and butt like other cartonnier crops. look great at first....after a few hours of wear the stretch out everywhere!!! absolutely terrible! i have several pairs of cartonnier crops that are my ""go to"" pants, but these are not worth even the sale price! i'd give them no stars if i could!! this fabric is very different from my other printed pairs. if u must try them, size down and suffer through the first few ""tight"" hours! trust me...they will",1,0,0,General,Bottoms,Pants
6331,6331,872,41,Big armholes!!!,Ordered this in white and the peachy color- the armholes were gaping. not well designed. i don't recommend this tee at all.,2,0,0,General Petite,Tops,Knits
6332,6332,385,39,Soft!,"Super soft comfy underwear. i sized up and they fit perfectly. normally wear xs and bought m for most comfortable fit. they don't ride up. i ended up ordering 5 more pairs. super comfy without being too ""mom"" like.",5,1,0,Initmates,Intimate,Intimates
6333,6333,1024,54,,"Love these pants! the print is very different, a little quirky, but black and light golden brown mixed together so very versatile. i have very thin legs and these are actually tight on me so maybe too slim for some.good length. they actually hit right at the ankle.",5,1,1,General,Bottoms,Jeans
6334,6334,938,49,Love it!,This is a great sweater. soft and beautiful. it's my new go to sweater??,5,1,0,General Petite,Tops,Sweaters
6335,6335,938,46,Good quality cardigan,"I really liked this cardigan when i saw it online. when i received it, i liked the quality of the yarn and the tie on the back, but the color seemed dull and i didn't like the huge safety pin on the lapel. i tried to remove it, but it was sewn on and was worried that if i snipped it off the thread, it might unravel the yarn. had to return it.",4,1,0,General Petite,Tops,Sweaters
6336,6336,872,47,Cute top!,"I tried on this top in the store in a large and the arm holes were too big. i am busty and usually wear a size 10, so i usually need a m to l. i ordered a m which was shipped to my home, and it fit perfectly. really cute with skinny jeans!",4,1,0,General Petite,Tops,Knits
6337,6337,385,39,"Pretty, but rides up","I wanted to love these because they are so pretty and come in lots of colors, but after only a few minutes of wearing them, i was having to pull them out of my bottom! why does women's underwear so frequently ride up? i normally wear a size 4/28, and ordered these in a m, but i guess they were still too small, which seems unreasonable to me. they are soft and pretty, but i will not be ordering more.",3,0,1,Initmates,Intimate,Intimates
6338,6338,985,35,Can't stop wearing it,"I'm 5'1"", <100 lbs. xs fits surprisingly well. the sleeves were rolled up when it arrived so i didn't noticed they were long. the wrinkled appearance looks fun and casual. 

the big drawback is that the interior seams poke and scratch my skin when i wore it over a halter top. even over a tee it was irritating in one spot. despite that, love it enough to keep.",4,1,4,General Petite,Jackets,Jackets
6339,6339,993,52,Lovelier in person!,"I'd been eyeing this skirt on the website, and was pleasantly surprised to find one hanging on the sale rack in a local store. i couldn't leave it behind. the silver embroidery and the lovely, flowinng weight of the tulle layers make this a beautiful skirt. i'm just over 5"" 4"" and it skims the floor on me with a 2"" heel. can't wait to wear it!",5,1,0,General Petite,Bottoms,Skirts
6340,6340,77,34,,,5,1,0,Initmates,Intimate,Legwear
6341,6341,1092,45,Missed the mark,"I loved the idea of this dress and was hoping it would be worth the astronomical price tag for what really is a cotton jersey dress. unfortunately, this dress missed the mark. in the pictures this dress looks like the fabrics are navy blue and some sort of white. well, it is not white or whitish at all but baby pink! bright baby pink! even the light pattern on the navy background is actually pink. huge disappointment. my other issue is with the length of this dress. the description says that the",2,0,10,General,Dresses,Dresses
6342,6342,984,38,Comfy and stylish,"I love this vest and could not leave without it. the color and lining just make it perfect, so stylish and comfy! i'm always a 8/10 and a m in this was perfect. the color is so beautiful and its so easy to dress up and down. i am big on the bottom, the tie in the back adds a nice shape to your whole profile and makes it a less boxy vest! love love...",5,1,2,General,Jackets,Jackets
6343,6343,938,25,,"Saw this online and ran over to the store to try it on. so lovely! i thought i would want it in the cream color but the blue was so lovely in person. it's like a muted blue that makes it so versatile. the detail in the back is gorgeous and so flattering. the safety pin is such a unique touch. it's nice and warm, just not super soft, but not scratchy. i do think i will be extra careful with it because it seems like it could get caught on things easily.",5,1,2,General Petite,Tops,Sweaters
6344,6344,872,40,,"Love this shirt. i am 5'2"" and 115 lbs. i am normally a pxs and got the pxxs and it got perfect! my new favorite shirt.",5,1,0,General Petite,Tops,Knits
6345,6345,993,42,Absolutely beautiful,"This dress is very beautiful. the dark color makes it very elegant. i tried on different top (white, silver, light blue, etc). they all look very nice with the dress. you can wear it casually or formally...depending on what kind of top you wear.",5,1,0,General Petite,Bottoms,Skirts
6346,6346,872,42,,"I tried this on in white and my usual size small. it is such a beautiful top and the detailing, lace trim is so pretty. my only complaint is that it lays funny on my cleavage, and i don't have much. it just gathered there and appeared clingy in that area. it's also one of those...am i hiding a pregnancy tops. i like it, but i think i'll wait to see if it goes on sale.",4,1,5,General Petite,Tops,Knits
6347,6347,937,66,Keeper,"Have been looking for a motorcycle style sweater for a while and hit the jackpot with this one. i have a large 34g bust and it's hard to find one without overly large lapels. these are perfect and they stay down, which is hard to find too. perfect length, beautiful color. not too long in the back. it has zipper pockets and the photos don't show the silver grommets on each side at the hem. the body of the sweater has a different knit than the sleeves so it has a bit of that vest over sweater look",5,1,3,General,Tops,Sweaters
6348,6348,937,37,Cute and stylish,"This sweater is very cute. i got a medium, i'm broad in the shoulders and a 34c. i wanted it a little loose. threw it over a tshirt and was not itchy at all. i feel it is light weight and perfect for our mild winters in florida. can't wait till the weather cools down to wear it.",5,1,1,General,Tops,Sweaters
6349,6349,871,26,,"Was hesitant to order it as first since i was worried it might be a little too boxy in person. glad i tried it since that turned out not to be the case. drapes nicely (exactly like in the picture) and can be worn either on its own or layered with a cardigan/shrug. loose fit means i can wear it to work, too. am usually between a small and xs but the xs fit me well. also wanted to mention this hits me right under the waist and i'm 5ft4 so there is a chance it could be a little too short for someon",5,1,4,General,Tops,Knits
6350,6350,938,48,Great casual sweater with lovely details,"I'm wearing lots of these long cardigans right now. this one is comfortable but holds up well. the blue color is a lovely wedgewood blue. the little tie detail on the back of the neck is cute, but doesn't get in the way. it's great for casual or casual work wear.",5,1,0,General Petite,Tops,Sweaters
6351,6351,938,65,Beautiful shade of blue,"Great, rather heavyweight, long cardi. i purchased the blue, which is a lovely shade of gray/blue, not quite as bright as the picture depicts. pin is adorable; doubt i'll ever use it to close the sweater, but still a nice touch. for reference i'm 5'5"", 136 lbs, 34ddd and typically fall between size small and medium. took a medium in this one and glad i did. perfect fit. falls exactly like on the model.",5,1,0,General Petite,Tops,Sweaters
6352,6352,938,31,,"Beware! there is a reason this sweater is on sale. it is not even remotely the same color as pictured. instead of the lovely antique blue in the photo, this sweater is a faded, boring, teal-green. what a huge disappointment.",1,0,0,General Petite,Tops,Sweaters
6353,6353,984,55,Ab fab!,"Love the distressed look and linen-like texture. the back ties cinch in for a custom fit & the knit hood is a nice touch. the length is great! fits tts (exactly as depicted) if not slightly roomy, which i like. absolutely fabulous!",5,1,4,General,Jackets,Jackets
6354,6354,872,35,,"Gorgeous top but runs large, especially in the arm holes.",3,1,0,General Petite,Tops,Knits
6355,6355,1059,26,For work and play,I knew i had to have these when i saw them on one of the retailer store instagrams. i bought them in the blue color combo and they are very comfortable and can be dressed up for work or paired with more casual clothing because of the material. they run a little large and have a lot of stretch so i would size down.,5,1,1,General,Bottoms,Pants
6356,6356,872,33,Beautiful top but too big,"I thought this top was absolutely beautiful! i couldn't wait to get it in but unfortunately it was very big on me. (i'm 5 ft, 105 lbs and got the pxs) the arm holes were so big as well as the overall fit. i'm very disappointed, i really wanted this top to work.",3,0,5,General Petite,Tops,Knits
6357,6357,1059,36,,"These pants are amazing and great quality! thank you to the reviewers who suggested sizing up one size. the trousers don't have a lot of stretch and are very cute and well-made and the size up is perfect! i am normally a 2r in most pants and skirts and i sized up to a 4r, they are perfect. gorgeous pattern, and i too, am not a ""pattern""-type. will go perfectly with a number of the solid, flowy maeve tops i have for work.",5,1,0,General,Bottoms,Pants
