,Serial_No,Clothing ID,Age,Title,Review Text,Rating,Recommended IND,Positive Feedback Count,Division Name,Department Name,Class Name
7717,7717,860,27,Cute tank,"This is a super cute tank- fits good, flowy and airy which is exactly what i had in mind for summer. fits good.",5,1,0,General,Tops,Knits
7718,7718,967,52,Nice accessory piece,"First of all, this doesn't come with a belt of any kind. that's a good thing, too. i am surprised that the stylist put one around this kimono. it looks odd, and, frankly, takes away from the shape of the piece. having said this, though, it is a nice accessory for basic tanks, t-shirts, and other tops and dresses that need a little umph...
the kimono is blue, mostly, but it really doesn't appear to be ""striped"". it is sort of a line of small dots. it is sheer, but the polyester fabric has some bo",4,1,15,General,Jackets,Jackets
7719,7719,936,34,Great fall/winter sweater,"This sweater is a great, comfy fall or winter sweater. in several of the pictures the neck is folded down, so beware that the neck has a bit of a turtleneck/mock neck look to it. it can be folded down if that's not the look you're going for. cute sweater!",5,1,1,General,Tops,Sweaters
7720,7720,936,54,Cute but poorly made,Weave on the sweater quite open and easily snags . the first day i wore it the seam on the sleeve began to unravel. needed to use a crochet hook to reweave after the first wearing. not confident that it will hold up well to its first wash.,2,0,21,General,Tops,Sweaters
7721,7721,860,37,,Super cute shirt. really flowy on the bottom - good if you want to hide your middle. great quality material.,4,1,0,General,Tops,Knits
7722,7722,867,37,,"Super cute, a little buggier than expected but great for layering after the gym.",4,1,0,General,Tops,Knits
7723,7723,936,32,Fell short,This sweater is amazing. color is vibrant. quality is high. but i have a super long torso and it fell short on me. if you are shorter this will be amazing. sad to send it back.,4,1,3,General,Tops,Sweaters
7724,7724,936,24,Disappointed,"I was really excited for this sweater, its not terrible but its not great. the sweater was large making me feel like a blob in it. it is warm and the fabric is pretty there was just no shape to it. i would try a different sweater.",3,0,0,General,Tops,Sweaters
7725,7725,842,36,Gorgeous and unique,"I love everything about this top. it is high volume and looks good with either a skinny pant or a structured voluminous pant. very sharp, but feminine and frilly look. i love the juxtaposition.",5,1,0,General,Tops,Blouses
7726,7726,886,33,Everyday staple,"Love this top. comfy, soft, and a great length. slightly longer in the back, and works great with leggings or jeans. i love that is has long sleeves. i wish it came in more colors.",5,1,0,General Petite,Tops,Knits
7727,7727,1008,54,Versatile skirt,"Just grabbed this today! great find. i paired it with a white blouse with blue polka dots....will pair with anything though, with great neutral colors. white or blue jean jackets, sweaters....the skirt has a little stretch for my hourglass figure, but would work with any type body i think. a many season skirt, perfect for traveling.",5,1,3,General,Bottoms,Skirts
7728,7728,1008,49,Really flattering,This is a fantastic skirt and very flattering. i plan to wear this with boots as shown on the model as well as sandals when it gets warmer. i would say that it does run true to size.,4,1,0,General,Bottoms,Skirts
7729,7729,824,44,Perfect find,I got this for my daughter (teen) who had been wanting this plaid look but didn't want to look like a lumberjack! this is feminine and can be dressed up or down. it has the high low look that she loves and it is comfortable and machine washable! she will get a lot of use out of this purchase! new item but black friday discount! yay! purchased in red color.,5,1,0,General Petite,Tops,Blouses
7730,7730,635,28,Can't wear a bra and it is see through,This is a great dress if you don't want to leave the house or you want the world to see your nipples.,1,0,0,General Petite,Intimate,Lounge
7731,7731,1075,28,Beautiful,I wore this dress for my small winter wedding and it was perfect! i thought it ran a little large though because i had to return it 2 times to get the right size! once i got the right size it fit perfectly. i loved the champagne color and shine.,5,1,0,General Petite,Dresses,Dresses
7732,7732,1008,31,,,5,1,0,General Petite,Bottoms,Skirts
7733,7733,825,34,"Beautiful, but not for me","The picture is not a good representation of the cut and the fabric. the cut is a-line, trapezoid-shaped. the shirt is smallest in the shoulders and chest and then it flairs out to the sides. the cut works with pants mostly, you have to tuck the shirt in if wearing with skirts. the lace back drapes beautifully and is a little longer than the front, which again lend to wearing with skinny pants and such.
the fabric has a quality of freshly starched. pleasant surprise. it lacks softness of leisure",4,1,9,General,Tops,Blouses
7734,7734,1094,53,Perfect maxi dress,Very flattering dress in a comfortable material. the cut is perfectly placed. this is very long. i'm 5'11 and in flats this touches the floor. easily dressed up or down with the tight accessories.,5,1,0,General,Dresses,Dresses
7735,7735,872,62,Itchy and odd fit,"I was so bummed when this came in...the colors and print are beautiful, but the neck is super itchy because of an elastic/ruffle combo. there is also a liner which is a nice touch, but it's significantly shorter than the top layer which drove me nuts. definitely going back.",2,0,3,General,Tops,Knits
7736,7736,824,39,Petite all the way,"If you are on the shorter side, do with the petite size. i ordered both (at first, petite was sold out) so glad i got to get it. i looked lost in the regular size, the back length was well below my bum. both colors are really nice, but i did end up with the orange one, more ""dressy"", red one looked more calsual (though it is a casual shiryt, i had on trousers, and hte orange looked nice with them).",5,1,0,General Petite,Tops,Blouses
7737,7737,824,33,Quality could be better,"I finally got my backorder today. i have a feeling that they might have rushed to make these and cut costs during production because as per all the reviews, i ordered my usual xs (122 lbs, 5'5"", 32d) and it just fits. all reviews previously before the backordered shirts were sent out, stated that the shirts ran big and people who normally wear a medium, bought an xs. i will keep my xs, but i would have purchased a small for a roomier fit. i have to wear a tank under it because it's short in the",4,1,0,General Petite,Tops,Blouses
7738,7738,855,43,This top is just meh,Wasn't crazy about this top. it looked great online but in person it's just a boring and lifeless top.,2,0,1,General,Tops,Knits
7739,7739,824,38,"Recommend, reservedly","I'm not sure how i feel about this shirt. i love the fabric, which is soft, lightweight, and richly colored. the polka dot trim is quirky and fun, and i like the idea of the twisted hem. the cut is generous in width, for sure; i ended up ordering a small because i swam in my usual medium-to-large sizes, but the length of the small barely works. the sleeves are juuuust long enough, and the shirt hits me just at the hip, not nearly as far down as the model shots show. it may be because i'm busty a",4,1,0,General Petite,Tops,Blouses
7740,7740,872,44,Odd neckline,"I loved the color and design until i tried it on in the store. i am 5'5"" with a slender build. i tried my usual xs but couldn't manage to put this shirt on me without risking smear my makeup or scratch my face by the elastic band at the neckline. the band is so small even fully stretched out. i have a normal sized head just in case you wonder... i gave up after wrestling with it. i can only imagine how uncomfortable to wear something with a tight elastic band choking me...funny... but not funny.",1,1,0,General,Tops,Knits
7741,7741,824,47,Perfect shirt!!!,I love this shirt. it is great quality and hangs perfectly! please make more colors in this one. i would buy all of them!!,5,1,0,General Petite,Tops,Blouses
7742,7742,859,45,,,5,1,0,General,Tops,Knits
7743,7743,886,41,Very flattering!,"I bought this shirt because i needed something lighter to where in autumn and needed to layer. i wasn't expecting so much out of a tshirt. the material is great. it's comfy and oh so flattering on any figure. i ordered the green one, and it was greener in person than online, but a very lovely color. it layers great, and is longer than expected. almost dress length. i'm not a tights wearer, but it would definitely go great with tights or leggings, and it worked fabulously under a wrap. great prod",5,1,0,General Petite,Tops,Knits
7744,7744,824,48,Flannel meets funky,"Love this top! a new take on traditional flannel. yes it is pricey for flannel, yes it is not thick like a traditional flannel shirt but it is feminine, sexy, comfortable....even my husband liked it on me. i ordered a regular small, wish i would've went for a petite x-small, however they are sold out. regardless i am keeping :-) for reference i am 5'3, 110-115 and the small is definitely roomy.",5,1,0,General Petite,Tops,Blouses
7745,7745,859,66,Looks just like the pic,"The fabric of this top is a tee shirt, mid weight material. it has a nice drape and the color variations along the vee are true to the photo. i purchased size large and it's a bit wide and long for my frame. you could safely size down. the fabric drapes nicely but i didn't like the sleeves or length and it fits large so am returning.",4,1,0,General,Tops,Knits
7746,7746,635,42,See through,I tried the yellow striped dress on in the store and it is completely sheer.,3,0,7,General Petite,Intimate,Lounge
7747,7747,824,29,Disappointing,"Ordered this top online and wanted to love it but the fit was very off. i love the drape in the front, but it did not hit in the right place. the fabric was soft, but not as high end looking as i was expecting. i love flannel tops and wanted a more formal look, but sadly this is going back.",3,0,0,General Petite,Tops,Blouses
7748,7748,824,37,"Beautiful, but not flattering","When i first saw this shirt online i was so excited! it reminded me of why i love shopping in the fall! unfortunately when it came i was so disappointed. in person the fabric and the colors are gorgeous. it's fairly lightweight for a flannel but so soft and comfy cozy. i love the navy/cream polka dot that is on the inside of the cuffs and collar as well, and the buttons are cute too! when i put it on it was so comfortable, but it made me look like i was pregnant! especially from the side it just",3,0,0,General Petite,Tops,Blouses
7749,7749,824,52,Draped plaid buttondown,"Great top - i have both colors. because the front is 'short' i ordered a medium. i usually wear a small. if you are not long waisted, like me, order the small.",5,1,1,General Petite,Tops,Blouses
7750,7750,635,51,Slouchy,"My 3 daughters and i all wear a size small and are heights range between 5'2 and 5'10 . this dress was sloppy on every one of us. i don't think a size x small would have made a difference. the length is all over the place .i""m not sure how or where you would fit a bra into the picture. on the positive side was very soft. it may work as a beach cover -up.",2,0,0,General Petite,Intimate,Lounge
7751,7751,1008,66,Great look/ light weight,This is an amazing looking skirt. it has such an exciting pattern on it and is very flattering. it is very light weight though....almost flimsy. but...it is not a deal breaker. i wear it and love it!,5,1,1,General Petite,Bottoms,Skirts
7752,7752,635,46,Striped tank dress,"Tried this twice in yellow because for the price it seems like it would be such a useful piece, but the quality is below average for an retailer dress. it's just a shapeless, thin, beach cover-up that i could've picked up anywhere. the yellow color is so cute though. if you're looking for a light, breezy, go-to-the-beach dress that you can shove in a bag with your towel, this might be good for you, but it's too thin for just about anything else.",2,0,0,General Petite,Intimate,Lounge
7753,7753,886,60,Greatest top ever!,"I took a chance on this in green, extra small (one size smaller than my normal size) because that was all that was left and i thought i could wear it under another sweater. no, it's too awesome to waste as a liner. it's the most amazing cut and fabric. it so flattering and so soft.

please bring back this top!!!!",5,1,0,General Petite,Tops,Knits
7754,7754,824,35,So soft and cozy,"I love this for a casual winter day. the fabric is so soft. the draping gives it a unique look. so cozy and nice. it's a bit big, though. opt to size down.",5,1,0,General Petite,Tops,Blouses
7755,7755,635,36,Very sheer and see through,"I purchased this in the yellow xs. it is very comfortable, but extremely see-through. you'd have to wear a slip or something underneath it, but i'm not sure what would work based on the style, and even if i wore a strapless bra it was still see-through. unfortunately i had to return it.",2,0,0,General Petite,Intimate,Lounge
7756,7756,824,47,Beautiful!,This is a gorgeous buttondown. the colors are stunning - i love the mix of blue and brown. the fabric is super soft and drapes just right. i feel the this shirt runs true to size. i'm an xxs petite and it fit perfect. this one is a winner!,5,1,0,General Petite,Tops,Blouses
7757,7757,824,41,Love the twist bottom,"Got this top in the blue/orange plaid. its super cute and i love the style much better than your typical straight button down plans shirt.
i highly recommend it!",5,1,0,General Petite,Tops,Blouses
7758,7758,855,48,Sheer shoulders,One can't tell from the picture but the top shoulder part is sheet and transparent. it also is very long almost dress length.  feels less quality than what retailer usually carries.,1,0,1,General,Tops,Knits
7759,7759,346,41,Beautiful color,I purchased the bright red color of this bandeau top. the color is vibrant and the overall style is very cute. unfortunately it made my chest look too big... but the quality is really nice and i'm sure it would look gorgeous on other body types.,4,1,1,Initmates,Intimate,Swim
7760,7760,986,40,Beautiful but won't last!,"I feel in love with this piece. the color are gorgeous and i received so many compliments. it lifted my mood just wearing it! sadly, ut the end of the first wear i had a run up the front and by the middle of the second wear the light fabric got caught on something and a hole developed. upon further inspection i found another hole at the top where the price tag must have been attached. i also noticed all over pilling after the first wear! so sad! they should recreate this in a heavy fabric.",1,0,1,General,Jackets,Jackets
7761,7761,1016,45,"Poor zipper, beautiful skirt","I tried on the skirt today in the store and immediately fell in love with how fluid the fabric is and how it looks and feels on, but i had something really awful happen, the zipper was hard to zip up so i just left it partially zipped but close to the top but then when i try to take it off the zipper broke and split down the middle but it was stuck on me! it was the strangest thing that i've ever had happened, and really embarrassing because i had to come out of the fitting room like that to get",4,1,7,General,Bottoms,Skirts
7762,7762,986,45,,"Read the reviews and thought i would just remove the label asap to prevent snags since i loved the item! 
however, the item came with unrepairable holes, not just snags and they are either on the neck or front sleeve which forces me to return the item asap. didn't even try it on. so sad, but i still love retailer!!!",2,0,0,General,Jackets,Jackets
7763,7763,1110,42,"Beautiful fabric and flow, but it's like a tent","I am 5' 4"" and 120 lbs. i bought the xs as my frame is a bit on the smaller side, but the cut is huge. a pregnant woman could easily pull this off as a very cool maternity dress. i can see it being so cute with a pair of boots or sandals. i wanted to get the xxs, but it's sold out so sadly will have to send it back. but if it works for you, definitely buy it!",4,1,3,General Petite,Dresses,Dresses
7764,7764,850,41,,My favorite for work or going out. the perfect black shirt.,5,1,0,General Petite,Tops,Blouses
7765,7765,986,43,Quality does not merit cost,"I generally don't write bad reviews, but there is a real discrepancy between the quality of this kimono and the cost. the design and colors are great, but the fabric is ripping on all the kimonos on the rack in my store where the manufacturer's tag is at the back of the neck. the material is very thin, so there are other small holes beginning throughout the garment. i shop at retailer all the time, and this is not a $98 item of clothing.",1,0,108,General,Jackets,Jackets
7766,7766,1016,49,"Beautiful fabric, poor zipper craftsmanship","I tried this on in the store, and the fabric is lovely - so, so soft and drapey. the skirt is very flattering - good length. but the zipper! the zipper was already ripped away from the fabric, so i wasn't able to purchase it. such a shame.",3,1,5,General,Bottoms,Skirts
7767,7767,986,29,,"Beautiful fabric! unfortunately, i had to return it. after just one wear, it had pills all over the side. fabric is too delicate. sad to return!",2,0,1,General,Jackets,Jackets
7768,7768,986,44,"Beautiful, maybe a bit ""too delicate""","I absolutely love the look & style of this piece! perfect for summer evenings. only complaint is that it feels maybe a bit too delicate. fabric is quite lightweight, and may be easy to tear. i will be taking special care of this & hoping to keep it looking great for the season.",4,1,9,General,Jackets,Jackets
7769,7769,1016,44,Not what i had in mind..,"I didn't realize when i ordered, that the hem is unfinished below the seam.. i'm not a fan of this look, especially in a more expensive skirt. the fabric is nice and flowy.. but i do feel there is maybe too much of it(which may be a plus if you wanted a fuller skirt) and that the waist runs slightly small. i am normally a 10-12 and ordered the large and it fit at my natural waist, rather than hanging lower and looser like other styles in this shape. i am 5'7"" and i do like fuller skirts, but was",3,0,3,General,Bottoms,Skirts
7770,7770,986,34,Material is awful,"Love retailer's kimonos and when i saw this pattern i had to have it! unfortunately, when i bought it the tag was already showing holes so they gave me 15% off... went to wear it for the first time, there was already a huge snag in it! i love retailer but for 98$ this is not worth your money.",1,0,1,General,Jackets,Jackets
7771,7771,88,42,Cute bedtime boyshort,"I got these pretty boy shorts because i was looking for a panty that was comfy for bedtime--pretty but with a fair amount of coverage. i am really happy with them. wonderful with a tank top or chemise. i think the ruffles are a bit bulky for skinny jeans, but i love them for sleeping. they feel special.",4,1,0,Initmates,Intimate,Intimates
7772,7772,1110,56,Very cute,"I like this dress because it has a 60's vibe. however, if this swing style is too long, it just looks dowdy. this dress was too long, so i shortened and redeemed mine. i am 5'3 1/2"" and 120 lbs. this style looks best on me just above the kneecap. if you try it on and hate it, it's probably because it's too long. in the winter i wear this with a long sweater (knee length) with a waistband in it to give it shape and with boots. the dress is lined but it is very, very sheer and requires a slip. or,",4,1,0,General Petite,Dresses,Dresses
7773,7773,986,42,Super cute but.....,This is super cute and the colors are so vibrant and its thin enough to wear with tanks for the summer but it already had a hole forming in the upper back shoulder.  i guess the material was a little too thin....$98 is a little too much money for something that gets holes so easily!,3,0,49,General,Jackets,Jackets
7774,7774,986,61,Love it but...,I snagged this the first day i wore it with my wedding ring. it is very delicate and i can't wear it when i'm with my kids because they pull on it so much! it will just me by night out wrap i guess!!!,3,1,1,General,Jackets,Jackets
7775,7775,986,45,"Stunning, but fabric is too thin","The colors on this kimono are amazing and i really loved it, however, i too noticed the 'delicateness' of the material. it is so delicate that parts were starting to fray - including next to the kimono's label. so sad.",1,0,6,General,Jackets,Jackets
7776,7776,516,32,Swim review,"This suit is really flattering and comfortable. i love the pattern and the removable strap. the only downside is the top of the suit folds down easily showing the lining at the top. this has been the case with other suits i've bought from retailer, but it's so flattering that i can live with that flaw.",4,1,6,Initmates,Intimate,Swim
7777,7777,867,41,Very slimming,"At first, i thought that this sweater would be too thin and show any imperfections, but it doesn't. the vertical ribbing really gives it a slimming effect and it is a perfect lightweight cover up that goes with pretty much anything.",5,1,1,General Petite,Tops,Knits
7778,7778,867,45,Gorgeous sweater!,This is an amazingly soft and gorgeous sweater. i typically avoid this brand because most of their pieces run smaller on my frame however this not only fit perfect but it is a beautiful color as well! i prefer transitional pieces that can be worn multiple seasons and this one is just right.,5,1,0,General Petite,Tops,Knits
7779,7779,928,56,Beautiful sweater,"This sweater is much prettier in person than in the picture. the colors are soft and feminine. medium fit me perfectly. this is the soft, cuddly sweater i have been looking for.",5,1,4,General,Tops,Sweaters
7780,7780,872,38,Great top for work,"This is a great top. i love how it's loose and hangs away from my body but is banded at the bottom so it isn't shapeless. the tie at the neck is cute and gives it some personality.

i usually bounce between a s or xs. i tried the xs in the store but ordered the s.",5,1,0,General Petite,Tops,Knits
7781,7781,872,53,Love this top!,I love this top! fits great n is elegant. great for the workplace n a night out. absolutely beautiful! quality fabric. love love love!,5,1,0,General Petite,Tops,Knits
7782,7782,820,31,,I love this shirt! lightweight and versatile! perfect for all seasons,5,1,1,General Petite,Tops,Blouses
7783,7783,872,39,,"Love this shirt! looks great with a pair of black work slacks or with jeans. very flattering with the banded hem, and the material is soft.",5,1,0,General Petite,Tops,Knits
7784,7784,820,35,"Smaller arms, larger body","I'll start by saying the fabric and concept are beautiful. the top is sheer, but that's pretty clear in the images and not surprising for a lightweight white blouse. the problem is that the arms are more fitted and the torso (not the chest, but the mid-section) is cut fairly wide. i'm 5'10"", 140#, 34b and usually wear a 4 or a small/medium depending on how relaxed i want the fit. i purchased this in a 4. the arms were workable but slightly fitted, and the torso fit like an 8. chest was as expect",2,0,7,General Petite,Tops,Blouses
7785,7785,820,50,Another beautiful white top,Great fit,5,1,0,General Petite,Tops,Blouses
7786,7786,867,37,,Crazy soft and comfy.  light weight so will be great for spring/ summer and layering.  so happy i bought it.,5,1,0,General Petite,Tops,Knits
7787,7787,867,39,Cuter than i thought,"I saw someone try this on when it was 40% off sale, and should ahve purcahsed it then... ended up going back today for it. it is very soft, adn flattering. also, i purchased the balck, this can go with pretty much anything: jeans, skirts, dresses, you name it - very neutral and flattering fit. nto sure if petite would have worked but too late anyway.",4,1,1,General Petite,Tops,Knits
7788,7788,867,69,Love this sweater!,"If you're looking for a sweater that's super soft and comfortable, you've found it! you could wear this almost anywhere except for a dressy occasion, but then, of course, you wouldn't wear it with a dress anyway. i wish it came in other colors because i'd buy several. it's on the thin side but not too thin. the only thing that i should mention is that it's not a black black but more of a faded or brownish black which is really obvious with black leggings or jeans.",5,1,12,General Petite,Tops,Knits
7789,7789,867,58,Classic but with an edge,"From the images, it looks like a basic black cardigan. look again because it's a beautiful fabric and can be dressed up or down. i'm 5""1 and always wear an xsmall at retailer however i thought it to wear over other articles vogue clothing i'd size up. it fits perfect i did an xsmall petite and couldn't be happier",5,1,8,General Petite,Tops,Knits
7790,7790,1059,65,Great summer pant!,These run small in the thighs and behind just like most of the other cartonnier pants. i have four pair of cartonnier pants that are all size 10...which is a size or two up from my usual 6 or 8 in other styles. print is great! fabric is super lightweight and great for summer.,4,1,8,General,Bottoms,Pants
7791,7791,872,41,,,4,1,0,General Petite,Tops,Knits
7792,7792,820,26,,"This top fits perfect everywhere except the sleeves are a little tight. not uncomfortably so but i wish they had just a little more room so they looked like they did in the picture. other than that, i love this shirt! its super cute and comfy and i have gotten a few compliments on it!",5,1,0,General Petite,Tops,Blouses
7793,7793,867,47,,It is soft and hangs great. problem - i wore it one time - and the back balled up terrible. it looked like i had owned it for years - not worn it one time. wouldn't recommend. though it is sooooo soft!,1,0,10,General Petite,Tops,Knits
