,Serial_No,Clothing ID,Age,Title,Review Text,Rating,Recommended IND,Positive Feedback Count,Division Name,Department Name,Class Name
7427,7427,820,30,Button problems,"Stylist in store warned be about issues with buttons falling of easily. loved the look, so bought it anyway. lost 2 buttons on the first wear. it did not feel snug on me, but i guess i could try a size up and see if the buttons hold a bit better. either way i will return or exchange.",3,0,2,General Petite,Tops,Blouses
7428,7428,1086,44,So flattering!,"This dress fits and flatters a curvy silhouette. size medium length is perfect for my 5'7"" frame. utterly comfortable and so many compliments!",5,1,0,General,Dresses,Dresses
7429,7429,1086,39,,I feel like i'm cheating when i put this on it's so comfy almost like wearing cozy pj's but with my black belt and boots and a cute scarf i can easily wine and dine looking like a million bucks and feeling like i'm lounging at the same time. i wish this came in more colors!!,5,1,0,General,Dresses,Dresses
7430,7430,1100,24,Perfectly easy,"This dress is my new best friend. i've been looking for work dresses that don't require much effort in putting together an outfit, and this is just it! the pattern is fun and unique (i got many compliments), the cut is comfortable, flattering and feminine. the dress really speaks for itself, and all i have to do is throw it on and run out the door. the only negative is there was a loose piece of thread at the bottom (fingers crossed this doesn't lead to problems later on) and the sleeve buttons",5,1,0,General Petite,Dresses,Dresses
7431,7431,502,35,,"I love love love this swimsuit! yes it's a bit pricey for a bathing suit, but i love the design and colors and the back detailing is sexy yet not all that revealing. i can't wait to wear it in hawaii next month! the only part to be careful about is not to stretch it too much when putting it on and taking it off, i can see the diamond cutouts stretching or even ripping if pulled too hard by accident. overall a great swimsuit for the summer!",5,1,4,Initmates,Intimate,Swim
7432,7432,948,49,Comfy cozy and cute,A very versatile and cozy top. would look great dressed up or down for a casual comfy fall day. what a fun piece for my wardrobe!,5,1,0,General,Tops,Sweaters
7433,7433,820,46,"Pretty, soft, comfortable and true to size","I ordered this in xl and the fit on me matches the fit on the model. it's meant to be loose & flowy so i think it's true to size. everything matches the photos--the sleeve length, hem, neckline, etc. it's not a slimming look but doesn't make me look bigger than i am either.

the material is a very soft cotton. the pattern of the lace on the top portion is very pretty. there are sequins mixed with the embroidery on the sleeves. the thread they used for those cutout areas is soft. it's washed well",5,1,0,General Petite,Tops,Blouses
7434,7434,948,37,"Great idea, in theory","Sctrachy, short, boxy, stiff.
loved the idea of this sweater, but this was not what i was hoping for",2,0,1,General,Tops,Sweaters
7435,7435,948,64,If you want a crop top...,"I love everything about this except the length. i am short and usually order a petite and even this is really cropped on me. the quality is good, thick and substantial, color is great but very cropped and sleeves are long on me as well. just weird proportions so sadly, going back.",2,0,5,General,Tops,Sweaters
7436,7436,338,46,Love,"Material is heavier so maybe not for summer months, but fit & feel great. love that they fall beyond the knee where other leggings can fall just below the knees and be uncomfortable and restricting which makes no sense for ""active"" wear.",5,1,0,Initmates,Intimate,Lounge
7437,7437,1076,51,Beautiful and slimming!,"I was pleasantly surprised by how well this dress skims over the body. definitely needs the belt that comes with the dress to add some shape. the color is gorgeous, great print and very light fabric - perfect for summer.",5,1,3,General,Dresses,Dresses
7438,7438,948,49,Way too scratchy!,"The minute i put this sweater on, i couldn't wait to take it off. it was way too scratchy for me. so, for those with any type of sensitivity to wool, this is not the sweater for you. otherwise, i thought the design was quite cute.",2,0,0,General,Tops,Sweaters
7439,7439,30,36,Runs large,"I love this dress, but have found that this brand runs large. i'd order a size down.",4,1,0,General Petite,Dresses,Dresses
7440,7440,1103,34,Beautiful maxi,Beautiful maxi fits tts. i normally wear a 10/12 and took a 12. it is flattering to the waist and makes me feel girly. the colors are so beautiful and the length is good for my 5'9 frame.,5,1,0,General,Dresses,Dresses
7441,7441,502,20,"No ""lined cups""","I just got this suit in and i was pretty excited about it, however it does not have lined cups like it says. no boob support whatsoever, though i think the pattern distracts enough that i'm keeping it anyways. (34dd). i do think it might be too short for a taller person. i'm only 5'4"" and it just barely comes up high enough to cover me, and i don't think big boobs are the reason. also it is pretty cheeky, which it does mention. maybe a little expensive, but i did use a coupon.",4,1,3,Initmates,Intimate,Swim
7442,7442,1103,39,Gorgeous print,"I fell in love with the color scheme and knew this would be perfect for vacations and weddings.  colors are slightly muted in reality, seems the retailer filter adds more contrast, but it's still gorgeous!   lining is full length, there's a zipper going up the back, fitted at the waist, and ribbon ties at the back of the neck that are long enough to style at the throat if wanted.  i wasn't sure of my size so i picked my larger range and i'm glad i did.  my weight fluctuates so when it goes down, t",5,1,2,General,Dresses,Dresses
7443,7443,941,64,A great long swtr w/ patch pockets!,"I ordered my usual sz s during the promo. arrived yesterday & the fit is perfect w/ a little room to spare for layering. it's a snap front closure, front patch pockets, & attached hood that is small to med size-not huge or overwhelming. it's 100% acrylic which isn't my 1st choice, but soft, comfy & seems good quality. length falls abt 3"" below my knees. arm length is fine. pretty much looks as in the pic including the marled color. if you are in need of a great functional long swtr w/ good looks",5,0,6,General,Tops,Sweaters
7444,7444,1115,26,Not very functional,"This vest doesn't have a button, so i thought i could put my own. but when it arrived, it just didn't fit that well. the opening in the front is too big, the vest itself while nice and warm is not functional at all due to openings everywhere. i don't know, why even make a vest like this with no front button and such a wide opening, how is one supposed to keep warm at all?",3,0,0,General,Jackets,Outerwear
7445,7445,1103,39,Great for an hourglass figure!,This dress is so beautiful & fits my hourglass figure perfectly. it's fully lined & the print is nicer in person. very easy dress to wear to many summer occasions! i'm an 8-10 on top & 10-12 on the bottom. size 10 dress fit perfectly!,5,1,3,General,Dresses,Dresses
7446,7446,907,53,Strange fit,"Note the sleeves on the model. that is how your regular size will fit your arms. however, even if you have skinny arms like i do, the sleeves will be tight. i bought my regular size xs and it was clingy with an odd flair and the length seems as though i ordered a petite and i am only 5 ft 2 in.
i advise to try a few sizes on if you really are interested. the red is truly a red which is a good thing because so often it is hard to find a red that is not neon.",2,0,4,General Petite,Tops,Fine gauge
7447,7447,862,41,Comfy sweatshirt,I have been living in mine since i bought it! so comfy and dressier than a plain sweatshirt!,5,1,1,General,Tops,Knits
7448,7448,907,45,,,5,1,0,General Petite,Tops,Fine gauge
7449,7449,439,45,Unique modern turtleneck,"Nice lines and texture but fit is very tight and i experienced the sizing to run small. i am 5'6"" and 115# with small frame. i usually wear xs or s from retailer, so ordered the turtleneck in small. the size small was super tight. i love the design so exchanging my order for a medium.",4,1,4,Initmates,Intimate,Layering
7450,7450,907,41,,Love this cardigan! it is a really a sweet and sexy top. so flattering to curves and yet conceals too. the material is wonderfully soft and stretchy.,5,1,8,General Petite,Tops,Fine gauge
7451,7451,907,57,True red cardigan,Wore my new red cardigan for the first time today to work. fit is tts. this is a true red and not neon or orange tinted. it wraps nicely in front and has a nice flair at the hips.. i also like the detail in the knit. i like to push my sleeves up and love the fact that they don't slide down my arms all day. i'll wear this cardigan a lot.,5,1,0,General Petite,Tops,Fine gauge
7452,7452,862,36,,"This is a great top. soft and cozy fabric, nice and sturdy feeling. it's heavier than i though it'd be so its perfect for the cooler days of spring, and even a chilly summer night. i love that it's long enough in the front for me to feel comfortable wearing leggings. the body is nice and roomy but the arms are a little snug, however, i like that because i think it makes it look less like a slubby sweatshirt. the best part... it can be cleaned in the washer and drier! thrilled with this purchase!",5,1,1,General,Tops,Knits
7453,7453,862,54,Cute and comfy,This top is really cute. my daughter tried it on and tried to take it.,5,1,2,General,Tops,Knits
7454,7454,439,53,"Nice turtlenceck, flattering style","I usually wear a medium or large in retailer clothes. i purchased this in a large and it fit perfectly. it is a clingier top but i didn't find it too much so. the ribbing makes it very attractive and slimming, and also can be worn as a stand alone turtleneck or easily as a layered piece. it is super soft and comfy as others have mentioned, and a tad thicker than just a cotton turtleneck would be - it has substance. also, it would be great for traveling because it doesn't wrinkle at all. love that!",5,1,2,Initmates,Intimate,Layering
7455,7455,907,41,,"Love the quality of this material, and how the lines fall on the back. i got a a medium petite because the small was sold out, and i like how it fits. petite sits around the hip area and it's not too long which i like. the color is definitely more of an orange/tangerine color - not red. great cover up sweater!",5,1,2,General Petite,Tops,Fine gauge
7456,7456,907,20,Soft and practical,I purchased this sweater in black to dress up my everyday cardigan. this is very soft and can dress up a skirt or great with jeans.,5,1,0,General Petite,Tops,Fine gauge
7457,7457,907,49,"Soft, a little shorter than expected","I like it a lot - very soft, just enough detail to keep it interesting, but still a classic look. i got this in a small and it's a little short on me compared to the model. i'm 5'6"", long-waisted, 34b (small side), 145lbs (carry bulk of my weight in legs.so trim on top). i will keep the small but also get a medium; the small ties a little high and i also want a sweater that can cover my shirt tails when i don't tuck them in.. i got it in black, so can't comment on the orange or red.",5,1,0,General Petite,Tops,Fine gauge
7458,7458,907,49,Perfect for me,"I just bought this cardigan in black at the store and i love it. the tie at the waist is flattering and the fabric is soft and stretchy. the regular size fit me perfectly as far as where the waist and hem hit, although the sleeves had to be turned up (i'm 5'1"" with more length in torso than limbs). i was so happy with the fit other than sleeve length that i bought the regular small rather than coming online for the petite. because the fabric is rather thin and the shape trim i can fold the sleev",5,1,1,General Petite,Tops,Fine gauge
7459,7459,862,39,,,3,1,0,General,Tops,Knits
7460,7460,907,42,Staple stylish piece,"I have been looking for a good red cardigan for some time now. this one perfectly meets my needs, and now i want it in more colors. the sweater has a nice cut, and it is very soft and comfortable. i know this will be a go to staple piece in my closet.",5,1,0,General Petite,Tops,Fine gauge
7461,7461,862,30,Simple and stylish,Chic and comfortable and looks great with skinny jeans or leggings. i'm usually a small/medium and thought the medium had a better overall look - sleeves were just a little long. the detail on the sleeves is kind of like the inside of a sweatshirt and makes it look a little more polished than the average athleisure top.,5,1,1,General,Tops,Knits
7462,7462,907,30,A pleasant surprise,"I bought the red cardigan because i didn't have anything similar and was so pleasantly surprised by the fit and design that i'm going have to buy it in whatever other colors are available. it's very versatile - looks great tied in front, in back, at the side - and has a tiny bit of flare at the bottom so it's more feminine and flirty than your average cardigan. i have a few tops by this brand and have been really happy with the quality and design.",5,1,2,General Petite,Tops,Fine gauge
7463,7463,439,39,Versatile and flattering,"This is a very nice turtleneck. the variations in the ribbing are a modern (and flattering) touch. in some of the photos online it almost looked to me like there are color variations - fyi there are not. all the ribbing areas are the same shade of black.
----------
unless you are very small framed, i would recommend sizing up; or, if you typically wear a m or a l, go with the l. as reference i have wide shoulders (wider than my hips), large biceps, and a 34b chest, and i went with the l because",5,1,21,Initmates,Intimate,Layering
7464,7464,907,23,Especially elegant with dress or skirt,"I never would have thought to choose this, but an retailer associate suggested the black sweater as a topper while i was trying on the camellia dropwaist dress, and it made a sale, i bought them both! the sweater, while not decked with beads or embroidery, adds an incredible definition to any outfit that is overly flowy. i would say the photo above showing the grey sweater says it all. usually a size 6 in retailer dresses, the small fit well. i appreciate the cotton fiber content, as well as the ver",5,1,2,General Petite,Tops,Fine gauge
7465,7465,907,48,Perfect,"Love this cardigan, ordered the red which is a nice tomato red, but not orange. sz medium fits perfect on my frame, 34dd, 145 lbs and 5 '4. love the style and finishes a pant, skirt or dress nicely. i just may order the black ! did not see this item in the store near me, but lucky to order it on sale. beautiful quality.",5,1,0,General Petite,Tops,Fine gauge
7466,7466,862,35,Most stylish sweatshirt i own now.,"This was such a nice surprise. it's way more sweatshirt than i thought, and maybe a touch bigger than i thought, but it's super cute and comfortable. i've worn it a bunch of times already.",5,1,1,General,Tops,Knits
7467,7467,862,32,Just what i wanted,This top is exactly what i was expecting. super comfortable while still looking stylish. just covers your bum so you can wear it with leggings or jeans!,5,1,1,General,Tops,Knits
7468,7468,841,60,Pretty,"Quite cute, it feels good on. the fit is tts and the colors are bright and just as depicted. i am a medium in most of retailer clothes and this fit nicely.",4,1,2,General,Tops,Blouses
7469,7469,862,32,,"I find myself gravitating towards comfortable items currently. this one caught my eye because of its length (tunic) and because, unlike many of the items right now, it actually appeared fitted. only after that did i notice the pretty detail on the sleeves.the price point is too high for a casual item such as this, but the sleeves do make up for it.
the cut is really great for my straight and slender body type. perfect! a great weight for those in-between temperatures that we'll be feeling as we",4,1,11,General,Tops,Knits
7470,7470,907,64,Great,What a nice sweater! i just received this in the gray and i think it is one of the most flattering sweaters i've gotten in a long time. the fit is true to size. the sleeves are very long and tight halfway to the elbows and fit well in the upper arms. the stitching on the body gives an illusion of height and is slenderizing. the weight is perfect for every season. i am very happy with everything about this sweater.,5,1,0,General Petite,Tops,Fine gauge
7471,7471,907,50,,"This is a beautiful sweater that i wanted to love but i couldn't for a few reasons i thought i'd share: the color is bright orange. it is not softer like peach in the picture. it also was more clingy than a curvy woman like me can wear. i thought'd be more swingy but it was more structured. very pretty and good quality,tho.",3,0,7,General Petite,Tops,Fine gauge
7472,7472,841,39,Okay but not at this price,"I feel that for this price, i should love this top (and i wanted to). however, the price is on the high side for a relatively basic top, and there were a few things about it that could be improved.
pros: i ordered a medium and feel that it's pretty true to size. additionally, the fabric is nice and light (but also *sheer*) and, generally speaking, has a nice pattern. overall, it's a very pretty top.
cons: there's a cute criss-cross ruffle thing happening in the back but the model has cleverly",2,0,12,General,Tops,Blouses
7473,7473,116,31,Not worth the money,Much lower quality than other robes i have purchased,2,0,0,Initmates,Intimate,Sleep
7474,7474,1075,31,Perfect easy summer outfit,"I love this dress and it is going to be my go-to summer dress. the fabric is great with just a slight amount of stretch. it is true to size. i am 5ft 8"" and it is not too short on me. the arm holes and the rest of the fitting is just perfect. the pockets are also very functional. the color is a darker moss than a brown that it looks like in the pictures. the retailer dresses i order online offlate are returned 90% of the time due to ill fitting or for not being what i expected in general, however",5,1,0,General,Dresses,Dresses
7475,7475,116,35,Comfortable and cozy,"I like this robe a lot. the tassel detailing on the ties is beautiful. i like the soft interior-but wish it went all the way down the arms. the cozy part of the robe is only in the center section and hood-the arms can be a bit chilly while the rest of you is warm and cozy.

i do not think the robe is necessarily flattering, in that it does not do me favors in the way of slimming, it is more of a cozy-around-the-house robe rather than one to hide lingerie underneath.",4,1,25,Initmates,Intimate,Sleep
7476,7476,1020,43,Amazing alternative to a denim skirt!,"Oh my god - i love this skirt. i first order the size 4 and immediately called customer service and had them send me a 2. i found it be be both plenty stretchy (great for moving, sitting, etc) but runs on the large size. but the fit is amazing. i love the length - a perfect knee-skimmer for me (5'9""). i love the color (green) and the pockets and button fly are so fun without being too much! i've tried it on with several tops and sweaters in my closet and this skirt is going to be one that i can",5,1,0,General,Bottoms,Skirts
7477,7477,968,38,Every vest has different coloration,"The material is so soft and cozy. there is just enough padding to keep me warm all year round in southern california. but, i ended up leaving the store without this vest  bc 1)the cut is slightly boxy.  2) every vest had different color variations. you definitely should go into the store to check it out. the ones i saw made the vest have cheap pattern of wide stripes, not an even vintage fade as shown. i'm so sad as everything else is perfect. fits true to size",3,1,0,General,Jackets,Jackets
7478,7478,836,53,Order a size up!,"What an adorable, classic style fringed top this is! i recently purchased this in my regular size but i should've read the reviews first and ordered a size up. when i went up from a size 6 to an 8 (34d-27-35), it fit me perfectly and looks so cute on! i think this one feels well made and i love the little details of the beads and how the fringe is placed. it looks very flapper girl;) i bought this on sale in the pink color and cannot wait until spring and summer to wear with jeans or a skirt!",5,1,3,General,Tops,Blouses
7479,7479,116,56,Doesn't wash well,"I wish i had read the other reviews before purchasing this product. label says that you can wash and dry normally. however, upon washing, the outer layer shrunk and the inner lining did not. the robe will now not lay flat; the fabric pulls at the edges, and results in the inner lining being revealed when the robe is tied shut. extremely disappointed. for a $100 garment, i expected much more. i wish i could return this.",1,0,0,Initmates,Intimate,Sleep
7480,7480,1020,62,The perfect skirt,"Almost the perfect skirt! great colors,super cute fit,very flattering,great length,very versatile. only issue was size; normally a solid 10, i ended up a full 2 sizes smaller. very stretchy and comfortable,just try it on first or order a couple of sizes. go down at least 1 size. as others have said...pilcro strikes again,its such a great brand with the most flattering shapes and fabrics.",5,1,0,General,Bottoms,Skirts
7481,7481,1059,39,Dreamy!,"These pants are fabulous. the flow and feel made my mind up easily to purchase these. i have a long torso and short muscular legs. the style complimented by body type. being culottes, the hem should probably fall higher up on my legs. i will probably have them hemmed. the pleat has a nice kick to it. now off to find the right pair of shoes...",5,1,1,General Petite,Bottoms,Pants
7482,7482,968,39,Versatile vest,"I took advantage of the sale this weekend & purchased this super cute vest yesterday which made it a more justifiable purchase. it's so soft, fits tts & i just can't wait for cooler weather so i can start wearing it!",5,1,0,General,Jackets,Jackets
7483,7483,1020,30,,,4,1,0,General,Bottoms,Skirts
7484,7484,116,63,Beautiful,I ordered this as a gift and may order myself one. it is so comfortable and pretty.,5,1,0,Initmates,Intimate,Sleep
7485,7485,1059,48,Classy look,"Loved these culottes! flattering fit and nice drape. the fabric, though poly, is of a nice weight and swishes nicely as you walk. the length (just below knee length) works for me too. the color is lovely for the fall - rich copper and easy to pair . i'd say these are tts but if in doubt, size down. i""m between a size 8-10 and the 8 works best for me.",5,1,0,General Petite,Bottoms,Pants
7486,7486,116,55,,,5,1,0,Initmates,Intimate,Sleep
7487,7487,116,59,,This robe is incredibly soft! it is wonderful to put on right after a shower and it is very warm! the sleeves are lined with a jersey like material and they are so easy to get on and off. it fits true to size. i am so excited to have this robe!!!,5,1,1,Initmates,Intimate,Sleep
7488,7488,1059,63,,I ordered these culottes because they looked comfortable yet elegant. they are indeed both!,5,1,0,General Petite,Bottoms,Pants
7489,7489,836,37,Disappointed,"So bummed. i was really hoping this top would work for me. i got the black in regular size 4 and the pink in petite size 4. both hit my breast too high and were too bulky in the mid section. i have a sort of short torso, wear a small 34c, and am have a defined waist. when tops are bulky, it gives me no shape and just looks terrible. i am having the hardest time finding pretty tops that suit my figure. they did not lie flat like on the model but had so much extra fabric they stuck out.
the constr",2,0,0,General,Tops,Blouses
7490,7490,1020,62,,"I have been looking for a tan color skirt so i ordered this as soon as i saw it. so glad i did the deep camel color can still be worn in late summer as styled in the product photos and transition to fall staple. the material is nice weight , and has a stretch. the cut has a little 60's vibe that i love. i think it should keep it's shape hopefully launders well. i think it runs slightly large, as my waist is large in comparison to my hip proportion and there is no pinch for me. i will rebuy this",5,1,3,General,Bottoms,Skirts
7491,7491,968,49,Dreamy vest,The vest looks  so stylish on. it makes a regular t shirt look edgy with it on. i love the vest but the price is too high,3,1,0,General,Jackets,Jackets
7492,7492,836,50,Strange fit,"This is a beautiful piece but the cut is not flattering. i ordered my usual small and while the top fit, the fringed part was huge, kind of ""maternity."" i can only imagine there was some clothes-pinning going on for the photo. this would have been great if it had about 4 inches of fabric removed from the lower part. obviously, it cannot be altered. so sad, must return.",3,0,12,General,Tops,Blouses
7493,7493,1059,66,Great piece for fall,"Cute and comfy. if you don't throw a leg out like the model above, it mostly reads as a skirt because the legs are so full. but it's really comfortable, and pairs well with a surprising number of tops",4,1,0,General Petite,Bottoms,Pants
7494,7494,1078,42,,"I am normally a size 8 in dresses and bought this in a small. so if you are a smaller person, this would likely be a bit loose on you. the color was odd. i liked the navy blue, but the pink was a pepto bismol colored pink. i just felt like i would get sick of the color/pattern after one wear. the fit is cute and comfy.",3,1,0,General,Dresses,Dresses
7495,7495,968,66,Cute but too puffy if you have a larger bust,"Ordered my regular size large and the fit was a snug around my hips when snapped. i didn't plan on wearing it that way so that wasn't a deal breaker for me. but because i have a larger bust i felt the padding added pounds and lots of width to my frame. i also had the same issues with coloring as other reviewers. and lastly, the collar is really high and it just bugged me. so this one went back.",3,1,0,General,Jackets,Jackets
