,Serial_No,Clothing ID,Age,Title,Review Text,Rating,Recommended IND,Positive Feedback Count,Division Name,Department Name,Class Name
6713,6713,868,67,Love!!,"I feel for the reviewer who didn't like this top. i tried on my normal size medium and it was not very flattering (just too short). when i sized up, everything changed. this top is amazing--super flattering and high quality. i love the material, v-cut, and subtle way the tassels hang. i wish they had more colors-i would buy them all! this top sold out in a day at my store. it's a winner-just make sure you size up.",5,1,4,General,Tops,Knits
6714,6714,1080,56,,"This dress is so flattering, i had wanted to try it on for awhile. when it hit sale w/ additional % off i headed to my local store. the dress fits like a dream, so darn cute for summer, in cali we have a lot of summer left. this dress pairs perfectly with the gretta espadrilles. my usual size small was perfect. hurry and get this perfect dress before it sells out!",5,1,1,General Petite,Dresses,Dresses
6715,6715,179,29,Poor bust design,"As a petite, big busted woman, i found this dress wildly unflattering. the quality and pattern of the dress itself is beautiful, though it will require a slip as it is completely transparent. the design of the bust however, i found unflattering.",3,0,2,Initmates,Intimate,Intimates
6716,6716,1080,41,,Absolutely love everything about this dress. unlike many other dresses i've ordered from retailer it fits me in the chest (34c). it's very flattering. love the lace up front and the fabric is like a soft lined linen. can't wait to wear it. i got the s regular. if i was any bigger in the chest or through the ribs tho it would be too small. i almost ordered the medium and was certain i would end up needing a bigger size but the small turned out just right. like it was made for me,5,1,9,General Petite,Dresses,Dresses
6717,6717,1033,26,Comfy jeans,My review isn't really about the jeans! i want the top!,4,1,1,General Petite,Bottoms,Jeans
6718,6718,1094,62,Flattering dress,"Soft, silky, lined in silky natural fabric, hangs great without being weighty. extremely flattering on my xl short body. i'm petite, but for tunic dresses always order regular sizes, so they go just a hint over my knees--exactly what i need. lovely details: sequins and weighted tassels. highly recommend!",5,1,0,General,Dresses,Dresses
6719,6719,865,56,My go-to top!,This is my very shirt i have ever bought at retailer! it's very comfortable and fashionable.,5,1,0,General,Tops,Knits
6720,6720,1100,62,Everyone loves this dress!,"I get so many compliments every time i wear this dress. friends, strangers, younger, older and even the pharmacist at my drugstore wanted to know where i bought the dress. it has a 70's vibe to it, fun and swingy. perfect for fall in florida with sandals or when it gets cooler, i think it will look great with leggings and boots. i purchased the orange and dark gray in a medium petite (i'm 5'4' and 135) and it hit just above my knee. my favorite dress right now!",5,1,1,General,Dresses,Dresses
6721,6721,1160,50,Close but not quite right,"I was looking for an undergarment and this is more of a nightgown.
if it came in a solid color then i'd probably buy it.
i usually wear a small and this was a tad too tight.
on the upside, the fabric was soft and lightweight.",3,0,1,Initmates,Intimate,Layering
6722,6722,1100,35,Works in any season!,"This dress is just what i was looking for. i ordered it in late summer. it was back ordered and i ended up wearing it on thanksgiving day! it's so comfortable, and just the right length. i wore it with leggings and boots, but it will be just as great with sandals in the spring.",5,1,0,General,Dresses,Dresses
6723,6723,868,58,The fringe on the bottom is great!,"I love this tank top...the fringe on the bottom is fun, and i've gotten many compliments on it already...i think it runs true to size :-)",4,1,0,General,Tops,Knits
6724,6724,1094,54,Stunning!,"This is a beautiful dress. it has great detail and is well made. the tassles are very heavy which is kind of funny because the dress is light and airy. it is pretty, cute and sexy all in one dress!",5,1,2,General,Dresses,Dresses
6725,6725,878,64,,Great tunic!  i get compliments every time i wear it. :),5,1,0,General Petite,Tops,Knits
6726,6726,1100,39,Perfect dress,I absolutely love this dress. it's flattering and feminine. you will love it. it runs large so size down.,5,1,0,General,Dresses,Dresses
6727,6727,1080,46,My fave this summer!,"Loved the dress on-line. ordered a petite small. fits perfectly. i am barely 5'5"" and carry my weight in hips and thighs. this fits perfectly without being too snug on the butt!! so, if you are a pear shape, get this dress!!",5,1,2,General Petite,Dresses,Dresses
6728,6728,1111,41,,"Beautifully embroidered dress.  it's loose fitting, not meant to be tailor fitted, so it would run large to you if that's what you were expecting.  the colors are gorgeous and the skirt has a really beautiful flow.  if you are hoping for a fitted look, size down one size.  there is plenty of stretch to this dress and plenty of room in the bust and waist.  i generally go between 00p and 0p, and got this in a 0p (though either would work).  it comes to just above my knees at 5'2"", 110, 32-24.5-32.",5,1,0,General,Dresses,Dresses
6729,6729,1094,58,Beautiful dress,"I saw this in the store and decided to try it on. it is so pretty. the fit is perfect. i didn't think that i would like it due to the sequins on the front. when i put it on, i didn't mind them at all. it really is a beautiful dress with beautiful colors. dry clean only is the only drawback to this one.",5,1,2,General,Dresses,Dresses
6730,6730,1100,38,,"Such a beautiful, flattering dress! i bought this to wear for our anniversary dinner and received so many compliments.",5,1,0,General,Dresses,Dresses
6731,6731,865,54,Asymetric draping,"I love clothing with elements that elevate them from basic to extraordinary. this tops does that for me: the black is a rich dark charcoal grey, the modal fabric blend has a nice feel and drapes well. however, the cut is very body conscious and i found both the medium and large tight in the midriff (my problem) area. since i love it so much, i will keep the medium since the sleeves are looser on the large. it looks exactly as pictured and would fit well on someone with a waistline.",4,1,11,General,Tops,Knits
6732,6732,1033,49,Nice jeans,"Good quality jeans, but had to return, as they did not fit my curvy hips.",4,1,0,General Petite,Bottoms,Jeans
6733,6733,1100,42,,"I understand the style of this dress is ""swing"", but there is just so much fabric, and it looked a bit like a tent on me. i ordered the s and i just found it to be too loose all over. the fabric is great and the colors are rich and lovely. this style would probably look better on someone smaller-chested, because there is no waist, it falls out from the bustline. cute dress, but i would size down.",4,0,0,General,Dresses,Dresses
6734,6734,986,68,Nice concept. disappointing reality.,"A good part of my closet is filled with retailer clothes. i mix them with my basics, scarves and jewelry. so, i immediately thought of a dozen ways this kimono could jazz up anything from skinny jeans to slip dresses, even though i felt it was pretty pricey. when it arrived, i was more than disappointed in the cheapness of the fabric. it does nothing for any of my intended clothes, so it is going back asap.",2,0,16,General,Jackets,Jackets
6735,6735,1111,62,"A knockoff, so what?","This dress is gorgeous, flattering, oood quality and, in my opinion, better than the erin fetherston dress because of the black, rather than nude liner, which really brought our the beautiful embroidery. come on, practically everything in rtw is a knockoff of something. i do have to comment that the slip is quite snug, though, but at least it's stretchy. that being said, it still had a bit of a tendency to creep up. i was glad i had a black half slip on as well. the fit is tts but a bit short wa",4,1,3,General,Dresses,Dresses
6736,6736,1111,56,Gorgeous dress,"I'm stunned by the bad reviews by others. i love this dress! it is an amazing, feminine, detailed, exceptional work of art, and lucky for me -- who usually takes 14s and 16s -- that it runs big. there is stretch to it, and it fits great! lucky, lucky me.",5,1,1,General,Dresses,Dresses
6737,6737,1053,36,Versatile joggers,"Great quality and cut! they are so versatile, which i love! highly recommend these!",5,1,6,General,Bottoms,Pants
6738,6738,844,27,Great length,"I am tall (5'11 and 3/4) and mostly leg with a shorter torso so i am always looking for longer shirts to balance my leg to torso ratio. i ordered this in the tan and blue colors in a large and so far have loved both of them. i am typically a medium in tops but tend to get the large for the extra length and have the top altered to fit if need be. however there was no need to alter these tops (making me think the tops typically run small). 

both tops are sheer requiring a tank of some sort to b",4,1,0,General,Tops,Blouses
6739,6739,1100,33,Paper crown does it again!,"This dress is beautiful. swingy and fun, and the floral pattern is just stunning for fall and winter. i am planning on wearing it with black tights and ankle booties. could be dressed up or down- very versitle. fits my tall curvy frame perfectly. love.",5,1,0,General,Dresses,Dresses
6740,6740,1111,58,,Saw this in the store and just had to have it. beautiful design. fits perfectly. looks nice with a belt as well.,5,1,0,General,Dresses,Dresses
6741,6741,1053,38,For slender legs only,"If you have muscular thighs, like me, these won't fit well. i'm usually a size 8-fitted/10-relaxed, i bought these in a large and the shins were the most relaxed part. had to return for not fitting well. but the quality of the product was nice.",3,1,4,General,Bottoms,Pants
6742,6742,1100,46,,,5,1,0,General,Dresses,Dresses
6743,6743,1033,28,Most comfortable jeans ever,"These literally are more comfortable than sweatpants. they are definitely ""relaxed"" and look a little baggier on than in the photo, but still cute and flattering.",5,1,5,General Petite,Bottoms,Jeans
6744,6744,1111,27,Floral and feminine,"This dress is a great dress for spring and summer (and early fall) events. it's surprisingly light weight and comfortable. you can pair different shoes with the dress due to the various colors which makes it easy to dress up and down. i definitely recommend if you're looking for a fun, floral, feminine dress.",5,1,4,General,Dresses,Dresses
6745,6745,1111,61,,"This is one fabulous-looking dress; however, the really scratchy neckline at the lace edge was a deal-breaker for me. i even tried sizing up, to see if that would help, but it was still too scratchy for me.",2,0,6,General,Dresses,Dresses
6746,6746,1094,39,Love & adore!,"Count me in as a five star lover of this dress! the details are so rich and interesting, so be prepared to get noticed when wearing. i'm happy to say that getting the size medium regular (instead of petite) was a good choice for my top heavy frame. the chest is fitted but not tight, the length is a not-too-short above knee, the tiered layers swing so nicely, and the beads/sequins add a touch is whimsy to the design. my one negative is the tassels at the neck tie--soo heavy cumbersome to style. o",5,1,6,General,Dresses,Dresses
6747,6747,1094,58,Beautiful just not for me,"This dress is lovely.  it flows nicely and is extremely flattering.  also true to size.  unfortunately i do not care for a lot of glitter/sparkle, which this dress has going down the very front so it is going back.  wish i could pull off the glitter but can't.  i absolutely love this dress otherwise and very much recommend it.",5,1,11,General,Dresses,Dresses
6748,6748,1053,53,"Nice quality, but....",These looked super cute online and i was excited about getting them. i wanted that slightly baggy look to be able to carry them off similar to the model. so i referred to the size chart and ordered the size that said it would allow this. based on the size chart for this item...it is wrong. i should have had extra room. instead they were tight around the hips. i measured my hips before ordering and i am a seamstress....so i know where and what to measure. this is a nice quality product though...j,3,1,2,General,Bottoms,Pants
6749,6749,1080,32,,,5,1,0,General Petite,Dresses,Dresses
6750,6750,844,41,Stunning!,Love this tunic...and so do others! so many compliments already!! i've worn it with skinny jeans as well as flowy black pants. it needs a cami underneath since it's sheer. i also like to wear it with my long retailer necklaces!,5,1,0,General,Tops,Blouses
6751,6751,1111,56,,"If it's a knock off, its of the ""poise"" dress, and a pretty good one at that. this is a beautiful dress that took my breath away the moment i saw it. when i saw such a poor rating i just had to see why. the erin fetherston dress is over $100 more and they look just about the same. i'd rather have the $ and the look!",5,1,18,General,Dresses,Dresses
6752,6752,1080,60,Lovely warm weather dress,"I love this style and was pleasantly surprised that it fit my curvy shape well, despite it being a fairly straight shift style. it does wrinkel easily because of the linen fabric, but otherwise is really perfect! it is dressy enough for bridal showers or brunches but could also be worn casually.",5,1,0,General Petite,Dresses,Dresses
6753,6753,844,57,Love it,"Very comfortable,  looks great on. like the color & fabric. something you can throw on & go",5,1,0,General,Tops,Blouses
6754,6754,831,37,,"Love this top! i'm 5' 118 lbs, purchased in a medium and plan on wearing it as a dress! it is so cute!",5,1,1,General Petite,Tops,Blouses
6755,6755,1100,34,Picture is misleading,This dress is navy and neutral stripes. not black and white. it fits true to the size width wise but is 2-3 inches shorter than the picture. to gain the length you might want to size up but it will be wider. the knot at the hip is beautiful and very flattering.,4,1,3,General,Dresses,Dresses
6756,6756,1033,57,Nice high waisted flare,"I'm so glad to own this one. i just tried it today and fully satisfied as always with pilcro. true to size, perfect color.
high waisted and flare just right. can be paired with cropped top or peasant top. looking taller on this outfit!
best of all i got it on sale!",5,1,0,General Petite,Bottoms,Jeans
6757,6757,1033,54,Ideal proportions,"The most disappointing thing about buying flare jeans when you're 5'4"" is taking them to the tailor to have a chunk of what makes them flares hacked off. not so with the petite 31"" inseam on these!!! love the perfect amount of stretch, the rise is high but not too high and the flare is perfect. definitely recommend.",5,1,4,General Petite,Bottoms,Jeans
6758,6758,862,34,"Less than ""just okay""","I was really excited for this top to arrive and was really disappointed once i tried it on. i am sure this is a gorgeous top on someone with a straighter or more slender frame. it is good quality and looks fine on the hanger. i think the color in the picture online accurately shows the color. ladies with hips or a booty, beware...this looked horrible on me! it clung to my butt and didn't hang nice and straight like it does in this picture. i expected the fabric to have a little give to it but it",1,0,1,General Petite,Tops,Knits
6759,6759,831,39,Love it!,I had this in my cart for a while online and ended up finding it in store. the medium fit good and looked great. i can't wait to wear it with a great pair of leggings. i did have to buy some static spray as it was sticking to my leggings i had on that day buying it.,5,1,2,General Petite,Tops,Blouses
6760,6760,1033,42,Runs smaller than usual pilcros...,"Love the pilcro brand, they are one of my favorites, even compared to other more expensive denim brands. i ordered my usual two sizes smaller and found they did not fit this time! i probably should have ordered one size smaller than my usual in this cut. sadly, i have to send these beauties back and hope for a pop-back.",5,1,0,General Petite,Bottoms,Jeans
6761,6761,1033,31,Love!,"I ordered a pair online, they came today and i am in love! the fit is great, i love the high rise waist. i will have to hem the bottom, i am a tad short (5'3"") and it is rare that i don't have to hem my jeans. they make my legs look longer and are a very flattering fit. i am very pleased with my purchase.",5,1,1,General Petite,Bottoms,Jeans
6762,6762,818,49,Pretty colors,Loved loved loved the shirt but...the material was so thin,2,0,0,General,Tops,Blouses
6763,6763,1126,83,Stunning!,"This coat is gorgeous. the minute i saw it online i ordered as fast as i can type!
when it arrived it exceeded my expectations in every way.
the lace detail is exquisite and the fit is so flattering.
i have the beatrice coat of last year and i so love it and this is equally beautiful.
a must for retailer shoppers. 
i ordered my usual size and it fits to perfection.",5,1,0,General Petite,Jackets,Outerwear
6764,6764,1033,44,Great flares,"Nice jeans, fit true to size and look as pictured. i recommended those to a friend and she bought and liked them as well.",5,1,0,General Petite,Bottoms,Jeans
6765,6765,1033,57,Great fitting jeans,"I love these jeans. the wash is nice enough for work. they fit well around the waist and have just the right mid-rise height, to make them stylish- not mom jeans at all. i am a pilcro convert. very comfortable too.",5,1,0,General Petite,Bottoms,Jeans
6766,6766,1033,31,Love these!,"I rarely even try on denim at retailer because i'm quite curvy and the styles, while cute on the models, rarely have fit me. not so with these jeans! they're my first pair of pilcros and a steal at the sale price! i'm 5'3"", 150lbs, 32d for reference and i purchased a regular 28, even though i'm often a 27 in my favorite long and lean jeans. they hug my butt and hips in a very sexy way, but not to the point of not being able to wear them at my office. i will need to get them hemmed, but not",5,1,0,General Petite,Bottoms,Jeans
6767,6767,1024,42,Sexy!!,"I was hesitant to order high rise pants, seems they only ever look good on a tall person. but these worked out perfect, i'm barely 5'6"", and the pants are just as long on me as the model in the picture, just barely brushing the floor when i'm in heels, though if i'm honest they do touch down a bit which will scuff them most likely, but to tailor 1/4 inch seems ridic. love them, super sexy, slimming, and elegant, the color is rich and the material is not too thick or thin, very comfortable stretc",5,1,0,General,Bottoms,Jeans
6768,6768,831,37,Great for leggings,"I love the length of this top and i love tops that don't cling in the tummy area. it fits well and the crochet detailing is nice. for reference, i'm 5'.4.5"", 150 lbs, 34dd and the m fit me well. since i'll be wearing this with leggings mostly during colder months, this top is a little bright and the material is not meant for cold days. since i live in texas, i can get away wearing it even in colder months.",4,1,0,General Petite,Tops,Blouses
6769,6769,831,63,Beautiful top,"This top definitely looks better in person. i thought it looked pretty online, but when i tried it on, it looked even better! this top is on the longer side and fits like it looks on the model. the fabric is perfect in my opinion because i don't have to 1) dry clean it, 2) iron it, or 3) worry about it itching or bothering my skin. i am 5'8"", 140 lbs, and 34 a/b. i purchased a size xs and it drapes wonderfully. i love the crochet around the neckline, the 3/4 length sleeves, and the colors of the",5,1,7,General Petite,Tops,Blouses
6770,6770,831,50,"Love, love, love!","Saw this top online and immediately had to purchase it! the first time i wore it i received many compliments... even my husband commented how cute it is. as shown in the photo, the back is longer than the front. i am 5'6"" and my top fell as the model's does. love this top and so happy with my purchase! i bought a size small, i normally wear medium or small tops. fit runs a little large, but small fit perfect!",5,1,7,General Petite,Tops,Blouses
6771,6771,1033,52,,"Love these jeans!! i ordered one pair and liked them so much i ordered another right away! i ordered the 26 regular.
yes, they are too long (i'm 5'4 1/2""# for flats, but look fantastic with heels #i need 2 1/2"" - 3"" to wear with these).
the fit is comfortable, they stretch just enough to look nice and still move with you. they are not binding at all.

the first time i wore them i got so many compliments. i even had a friend tell me she did not understand why flares were coming back because she t",5,1,0,General Petite,Bottoms,Jeans
6772,6772,1033,31,Finally!!,"These are absolutely fantastic! i love them!
i stopped wearing pants about 4 years ago. i could never find any that would fit over my thighs/hips that weren't too loose on my waist. took a chance with these after looking at the measurements and they fit perfect. higher waist than i'm used (sits just above my natural waistline) to with any of my skirts, but i'll get used to it. they're also too long to wear with any flats. being that i bought them for winter, i'll be perfectly fine with heeled bo",4,1,0,General Petite,Bottoms,Jeans
6773,6773,1033,40,Not for me but cute,These are a wonderful trouser style pant. i love fitted than flared denim so this fit isn't my top pick but it's a cute style! thick quality denim fabric with a medium rise cut.,3,1,0,General Petite,Bottoms,Jeans
6774,6774,995,30,,I loved this skirt. the material is so fun and a love the pattern. unfortunately they didn't have the size i needed so it had to go back to the store,5,1,0,General,Bottoms,Skirts
6775,6775,1033,40,,"I don't know why i had the opposite problem most reviewers had with these..... i tried on the regular length in the store and found that they were just a bit too short with heels. (i'm 5'5 ). i had them ordered in a petite and when they came, they were too short with flats! maybe it's the way i like to wear them, i like my flare jeans to barely skim the ground. i just exchanged them for regular length and will wear them with a small wedge shoe. aside from the length issues, these are super cute",4,1,0,General Petite,Bottoms,Jeans
6776,6776,1024,33,Beautiful color and very flattering,"These were as great in person as i had hoped; great color for fall, super comfy and flattering fit. happy with my purchase!",5,1,0,General,Bottoms,Jeans
6777,6777,1044,55,Love the look but.....,I ordered this in a regular medium even though i am short i never order petite pants as the crotch is always too short...but this crotch is very long.....i have exchanged for a medium petite and hopefully that will work. i have last years short denim romper by the same brand and did not run into this issue.,4,1,3,General Petite,Bottoms,Pants
6778,6778,1044,45,Spring and summer gotta have it,I am so happy i ordered this jumpsuit. it is exactly as pictured and has a very flattering fit. the fabric is light and it's very well made. great length for dressing up with heals or dressing down with flats. i love it!,5,1,1,General Petite,Bottoms,Pants
6779,6779,1072,40,Amazing. read my info about sizing before ordering,"Just got this dress in the mail yesterday and i love the style and fabric soooo much!!! the fabric looks kind of shiny in the photos so i wasn't quite sure, however in person it's a perfect blend that can easily be dressed up or down. sadly i cannot fully see how it looks on me because the bust of it is way too small. i normally wear a 0 or 2 in a dress and am a 32c but the inside panel that you cannot see in any of the photos is very fitted to the chest and i cannot even zip the size 2 over my",5,1,5,General,Dresses,Dresses
6780,6780,877,43,Cute top!,This top is very flattering and the silver line details give it a great pop of color!,4,1,2,General,Tops,Knits
6781,6781,1030,39,So crazy comfortable,"I haven't worn jeans in a year because i felt uncomfortable and constrained. these are as soft as my leggings. they have so much stretch, you could do yoga in them. if you want the jean look w/o the stiffness/structure, get these. flattering to the booty too.",5,1,0,General,Bottoms,Jeans
6782,6782,895,25,Absolutely amazing!!,I kept going back to this sweater as this goes with so many different bottoms! thank you retailer! i ordered the petite version since i am not as tall as the model so the length is perfect! the speckles of gray are beautiful and would frame any complexion! the fit if flattering with straight pants or short skirts.,5,1,3,General,Tops,Fine gauge
6783,6783,1030,51,Not the same...,"I agree with other reviewer, the material of these jeans is not the same! thin, stretches, and you end up pulling them up all the time. i am a short, curvy girl and would love to have the old jean fabric back! this seems to be the trend in jeans?nydj also uses this fabric?stretches too much.",2,0,0,General,Bottoms,Jeans
6784,6784,1078,39,Surprisingly comfy and flattering,"I ordered the xxs p and it is almost big, so between true to size and big. it is both flattering and stretchy. the waist comes in nicely, the sleeves are not annoying, and the sparkle add to the lbd in my opinion. length was right above the knee.just. i am 115 lbs, 30dd, 26.5 in waist for reference...",5,1,0,General,Dresses,Dresses
